root@comp3134-Winter2023:~# tcpdump -i eth0
tcpdump: verbose output suppressed, use -v or -vv for full protocol decode
listening on eth0, link-type EN10MB (Ethernet), capture size 262144 bytes
21:37:25.361256 IP comp3134-Winter2023.ssh > cpee0dbd1ce3c00-cme0dbd1ce3bfe.cpe.net.cable.rogers.com.62719: Flags [P.], seq 3693501317:3693501425, ack 3247731800, win 1573, length 108
21:37:25.361356 IP comp3134-Winter2023.ssh > cpee0dbd1ce3c00-cme0dbd1ce3bfe.cpe.net.cable.rogers.com.62719: Flags [P.], seq 108:144, ack 1, win 1573, length 36
21:37:25.361375 IP comp3134-Winter2023.ssh > cpee0dbd1ce3c00-cme0dbd1ce3bfe.cpe.net.cable.rogers.com.62719: Flags [P.], seq 144:252, ack 1, win 1573, length 108
21:37:25.361411 IP comp3134-Winter2023.ssh > cpee0dbd1ce3c00-cme0dbd1ce3bfe.cpe.net.cable.rogers.com.62719: Flags [P.], seq 252:288, ack 1, win 1573, length 36
21:37:25.362123 IP comp3134-Winter2023.59632 > 67.207.67.3.domain: 4898+ [1au] PTR? 210.39.228.99.in-addr.arpa. (55)
21:37:25.362205 IP comp3134-Winter2023.50089 > 67.207.67.3.domain: 57465+ [1au] PTR? 210.39.228.99.in-addr.arpa. (55)
21:37:25.362427 IP 67.207.67.3.domain > comp3134-Winter2023.59632: 4898 1/0/1 PTR cpee0dbd1ce3c00-cme0dbd1ce3bfe.cpe.net.cable.rogers.com. (124)
21:37:25.362450 IP comp3134-Winter2023 > 67.207.67.3: ICMP comp3134-Winter2023 udp port 59632 unreachable, length 160
21:37:25.362533 IP 67.207.67.3.domain > comp3134-Winter2023.50089: 57465 1/0/1 PTR cpee0dbd1ce3c00-cme0dbd1ce3bfe.cpe.net.cable.rogers.com. (124)
21:37:25.362545 IP comp3134-Winter2023 > 67.207.67.3: ICMP comp3134-Winter2023 udp port 50089 unreachable, length 160
21:37:25.362704 IP comp3134-Winter2023.49846 > 67.207.67.3.domain: 6800+ [1au] PTR? 206.214.110.143.in-addr.arpa. (57)
21:37:25.362754 IP comp3134-Winter2023.42342 > 67.207.67.3.domain: 51661+ [1au] PTR? 206.214.110.143.in-addr.arpa. (57)
21:37:25.362800 IP comp3134-Winter2023.60978 > 67.207.67.3.domain: 60728+ [1au] PTR? 206.214.110.143.in-addr.arpa. (57)
21:37:25.363217 IP 67.207.67.3.domain > comp3134-Winter2023.42342: 51661 NXDomain 0/1/1 (124)
21:37:25.363217 IP 67.207.67.3.domain > comp3134-Winter2023.49846: 6800 NXDomain 0/1/1 (124)
21:37:25.363217 IP 67.207.67.3.domain > comp3134-Winter2023.60978: 60728 NXDomain 0/1/1 (124)
21:37:25.363337 IP comp3134-Winter2023.42342 > 67.207.67.3.domain: 51661+ PTR? 206.214.110.143.in-addr.arpa. (46)
21:37:25.363399 IP comp3134-Winter2023.60978 > 67.207.67.3.domain: 60728+ PTR? 206.214.110.143.in-addr.arpa. (46)
21:37:25.363485 IP comp3134-Winter2023.49846 > 67.207.67.3.domain: 6800+ PTR? 206.214.110.143.in-addr.arpa. (46)
21:37:25.363615 IP 67.207.67.3.domain > comp3134-Winter2023.42342: 51661 NXDomain 0/1/0 (113)
21:37:25.363634 IP 67.207.67.3.domain > comp3134-Winter2023.60978: 60728 NXDomain 0/1/0 (113)
21:37:25.363942 IP 67.207.67.3.domain > comp3134-Winter2023.49846: 6800 NXDomain 0/1/0 (113)
21:37:25.364635 IP comp3134-Winter2023.ssh > cpee0dbd1ce3c00-cme0dbd1ce3bfe.cpe.net.cable.rogers.com.62719: Flags [P.], seq 288:508, ack 1, win 1573, length 220
21:37:25.365502 IP comp3134-Winter2023.ssh > cpee0dbd1ce3c00-cme0dbd1ce3bfe.cpe.net.cable.rogers.com.62719: Flags [P.], seq 508:544, ack 1, win 1573, length 36
21:37:25.365678 IP comp3134-Winter2023.ssh > cpee0dbd1ce3c00-cme0dbd1ce3bfe.cpe.net.cable.rogers.com.62719: Flags [P.], seq 544:740, ack 1, win 1573, length 196
21:37:25.365769 IP comp3134-Winter2023.ssh > cpee0dbd1ce3c00-cme0dbd1ce3bfe.cpe.net.cable.rogers.com.62719: Flags [P.], seq 740:776, ack 1, win 1573, length 36
21:37:25.365855 IP comp3134-Winter2023.ssh > cpee0dbd1ce3c00-cme0dbd1ce3bfe.cpe.net.cable.rogers.com.62719: Flags [P.], seq 776:972, ack 1, win 1573, length 196
21:37:25.366343 IP comp3134-Winter2023.57238 > 67.207.67.3.domain: 31974+ [1au] PTR? 3.67.207.67.in-addr.arpa. (53)
21:37:25.366486 IP comp3134-Winter2023.38347 > 67.207.67.3.domain: 33955+ [1au] PTR? 3.67.207.67.in-addr.arpa. (53)
21:37:25.366551 IP comp3134-Winter2023.39870 > 67.207.67.3.domain: 1311+ [1au] PTR? 3.67.207.67.in-addr.arpa. (53)
21:37:25.366840 IP 67.207.67.3.domain > comp3134-Winter2023.57238: 31974 NXDomain 0/1/1 (120)
21:37:25.366841 IP 67.207.67.3.domain > comp3134-Winter2023.38347: 33955 NXDomain 0/1/1 (120)
21:37:25.366841 IP 67.207.67.3.domain > comp3134-Winter2023.39870: 1311 NXDomain 0/1/1 (120)
21:37:25.367000 IP comp3134-Winter2023.57238 > 67.207.67.3.domain: 31974+ PTR? 3.67.207.67.in-addr.arpa. (42)
21:37:25.367327 IP comp3134-Winter2023.39870 > 67.207.67.3.domain: 1311+ PTR? 3.67.207.67.in-addr.arpa. (42)
21:37:25.367342 IP 67.207.67.3.domain > comp3134-Winter2023.57238: 31974 NXDomain 0/1/0 (109)
21:37:25.394710 IP cpee0dbd1ce3c00-cme0dbd1ce3bfe.cpe.net.cable.rogers.com.62719 > comp3134-Winter2023.ssh: Flags [.], ack 972, win 8280, length 0
21:37:25.394790 IP comp3134-Winter2023.ssh > cpee0dbd1ce3c00-cme0dbd1ce3bfe.cpe.net.cable.rogers.com.62719: Flags [P.], seq 972:3892, ack 1, win 1573, length 2920
21:37:25.394828 IP comp3134-Winter2023.ssh > cpee0dbd1ce3c00-cme0dbd1ce3bfe.cpe.net.cable.rogers.com.62719: Flags [P.], seq 3892:6812, ack 1, win 1573, length 2920
21:37:25.394897 IP comp3134-Winter2023.ssh > cpee0dbd1ce3c00-cme0dbd1ce3bfe.cpe.net.cable.rogers.com.62719: Flags [P.], seq 6812:7344, ack 1, win 1573, length 532
21:37:25.395041 IP comp3134-Winter2023.ssh > cpee0dbd1ce3c00-cme0dbd1ce3bfe.cpe.net.cable.rogers.com.62719: Flags [P.], seq 7344:7524, ack 1, win 1573, length 180
21:37:25.395095 IP comp3134-Winter2023.ssh > cpee0dbd1ce3c00-cme0dbd1ce3bfe.cpe.net.cable.rogers.com.62719: Flags [P.], seq 7524:7560, ack 1, win 1573, length 36
21:37:25.395156 IP comp3134-Winter2023.ssh > cpee0dbd1ce3c00-cme0dbd1ce3bfe.cpe.net.cable.rogers.com.62719: Flags [P.], seq 7560:7756, ack 1, win 1573, length 196
21:37:25.395197 IP comp3134-Winter2023.ssh > cpee0dbd1ce3c00-cme0dbd1ce3bfe.cpe.net.cable.rogers.com.62719: Flags [P.], seq 7756:7792, ack 1, win 1573, length 36
21:37:25.395252 IP comp3134-Winter2023.ssh > cpee0dbd1ce3c00-cme0dbd1ce3bfe.cpe.net.cable.rogers.com.62719: Flags [P.], seq 7792:7996, ack 1, win 1573, length 204
21:37:25.395325 IP comp3134-Winter2023.ssh > cpee0dbd1ce3c00-cme0dbd1ce3bfe.cpe.net.cable.rogers.com.62719: Flags [P.], seq 7996:8228, ack 1, win 1573, length 232
21:37:25.395363 IP comp3134-Winter2023.ssh > cpee0dbd1ce3c00-cme0dbd1ce3bfe.cpe.net.cable.rogers.com.62719: Flags [P.], seq 8228:8264, ack 1, win 1573, length 36
21:37:25.395409 IP comp3134-Winter2023.ssh > cpee0dbd1ce3c00-cme0dbd1ce3bfe.cpe.net.cable.rogers.com.62719: Flags [P.], seq 8264:8460, ack 1, win 1573, length 196
21:37:25.395447 IP comp3134-Winter2023.ssh > cpee0dbd1ce3c00-cme0dbd1ce3bfe.cpe.net.cable.rogers.com.62719: Flags [P.], seq 8460:8496, ack 1, win 1573, length 36
21:37:25.395493 IP comp3134-Winter2023.ssh > cpee0dbd1ce3c00-cme0dbd1ce3bfe.cpe.net.cable.rogers.com.62719: Flags [P.], seq 8496:8692, ack 1, win 1573, length 196
21:37:25.395543 IP comp3134-Winter2023.ssh > cpee0dbd1ce3c00-cme0dbd1ce3bfe.cpe.net.cable.rogers.com.62719: Flags [P.], seq 8692:8728, ack 1, win 1573, length 36
21:37:25.395593 IP comp3134-Winter2023.ssh > cpee0dbd1ce3c00-cme0dbd1ce3bfe.cpe.net.cable.rogers.com.62719: Flags [P.], seq 8728:8924, ack 1, win 1573, length 196
21:37:25.395634 IP comp3134-Winter2023.ssh > cpee0dbd1ce3c00-cme0dbd1ce3bfe.cpe.net.cable.rogers.com.62719: Flags [P.], seq 8924:8960, ack 1, win 1573, length 36
21:37:25.395683 IP comp3134-Winter2023.ssh > cpee0dbd1ce3c00-cme0dbd1ce3bfe.cpe.net.cable.rogers.com.62719: Flags [P.], seq 8960:9156, ack 1, win 1573, length 196
21:37:25.395723 IP comp3134-Winter2023.ssh > cpee0dbd1ce3c00-cme0dbd1ce3bfe.cpe.net.cable.rogers.com.62719: Flags [P.], seq 9156:9192, ack 1, win 1573, length 36
21:37:25.420641 IP cpee0dbd1ce3c00-cme0dbd1ce3bfe.cpe.net.cable.rogers.com.62719 > comp3134-Winter2023.ssh: Flags [.], ack 9192, win 8280, length 0
21:37:25.420721 IP comp3134-Winter2023.ssh > cpee0dbd1ce3c00-cme0dbd1ce3bfe.cpe.net.cable.rogers.com.62719: Flags [P.], seq 9192:11744, ack 1, win 1573, length 2552
21:37:25.420917 IP comp3134-Winter2023.ssh > cpee0dbd1ce3c00-cme0dbd1ce3bfe.cpe.net.cable.rogers.com.62719: Flags [P.], seq 11744:11932, ack 1, win 1573, length 188
21:37:25.421041 IP comp3134-Winter2023.ssh > cpee0dbd1ce3c00-cme0dbd1ce3bfe.cpe.net.cable.rogers.com.62719: Flags [P.], seq 11932:11968, ack 1, win 1573, length 36
21:37:25.421103 IP comp3134-Winter2023.ssh > cpee0dbd1ce3c00-cme0dbd1ce3bfe.cpe.net.cable.rogers.com.62719: Flags [P.], seq 11968:12172, ack 1, win 1573, length 204
21:37:25.421167 IP comp3134-Winter2023.ssh > cpee0dbd1ce3c00-cme0dbd1ce3bfe.cpe.net.cable.rogers.com.62719: Flags [P.], seq 12172:12412, ack 1, win 1573, length 240
21:37:25.421202 IP comp3134-Winter2023.ssh > cpee0dbd1ce3c00-cme0dbd1ce3bfe.cpe.net.cable.rogers.com.62719: Flags [P.], seq 12412:12448, ack 1, win 1573, length 36
21:37:25.421241 IP comp3134-Winter2023.ssh > cpee0dbd1ce3c00-cme0dbd1ce3bfe.cpe.net.cable.rogers.com.62719: Flags [P.], seq 12448:12652, ack 1, win 1573, length 204
21:37:25.421276 IP comp3134-Winter2023.ssh > cpee0dbd1ce3c00-cme0dbd1ce3bfe.cpe.net.cable.rogers.com.62719: Flags [P.], seq 12652:12688, ack 1, win 1573, length 36
21:37:25.421321 IP comp3134-Winter2023.ssh > cpee0dbd1ce3c00-cme0dbd1ce3bfe.cpe.net.cable.rogers.com.62719: Flags [P.], seq 12688:12892, ack 1, win 1573, length 204
21:37:25.421374 IP comp3134-Winter2023.ssh > cpee0dbd1ce3c00-cme0dbd1ce3bfe.cpe.net.cable.rogers.com.62719: Flags [P.], seq 12892:13132, ack 1, win 1573, length 240
21:37:25.421415 IP comp3134-Winter2023.ssh > cpee0dbd1ce3c00-cme0dbd1ce3bfe.cpe.net.cable.rogers.com.62719: Flags [P.], seq 13132:13168, ack 1, win 1573, length 36
21:37:25.421460 IP comp3134-Winter2023.ssh > cpee0dbd1ce3c00-cme0dbd1ce3bfe.cpe.net.cable.rogers.com.62719: Flags [P.], seq 13168:13372, ack 1, win 1573, length 204
21:37:25.421497 IP comp3134-Winter2023.ssh > cpee0dbd1ce3c00-cme0dbd1ce3bfe.cpe.net.cable.rogers.com.62719: Flags [P.], seq 13372:13408, ack 1, win 1573, length 36
21:37:25.421543 IP comp3134-Winter2023.ssh > cpee0dbd1ce3c00-cme0dbd1ce3bfe.cpe.net.cable.rogers.com.62719: Flags [P.], seq 13408:13612, ack 1, win 1573, length 204
21:37:25.421581 IP comp3134-Winter2023.ssh > cpee0dbd1ce3c00-cme0dbd1ce3bfe.cpe.net.cable.rogers.com.62719: Flags [P.], seq 13612:13648, ack 1, win 1573, length 36
21:37:25.421672 IP comp3134-Winter2023.ssh > cpee0dbd1ce3c00-cme0dbd1ce3bfe.cpe.net.cable.rogers.com.62719: Flags [P.], seq 13648:13852, ack 1, win 1573, length 204
21:37:25.421804 IP comp3134-Winter2023.ssh > cpee0dbd1ce3c00-cme0dbd1ce3bfe.cpe.net.cable.rogers.com.62719: Flags [P.], seq 13852:14368, ack 1, win 1573, length 516
21:37:25.421858 IP comp3134-Winter2023.ssh > cpee0dbd1ce3c00-cme0dbd1ce3bfe.cpe.net.cable.rogers.com.62719: Flags [P.], seq 14368:14572, ack 1, win 1573, length 204
21:37:25.421892 IP comp3134-Winter2023.ssh > cpee0dbd1ce3c00-cme0dbd1ce3bfe.cpe.net.cable.rogers.com.62719: Flags [P.], seq 14572:14608, ack 1, win 1573, length 36
21:37:25.421912 IP comp3134-Winter2023.ssh > cpee0dbd1ce3c00-cme0dbd1ce3bfe.cpe.net.cable.rogers.com.62719: Flags [P.], seq 14608:14812, ack 1, win 1573, length 204
21:37:25.421943 IP comp3134-Winter2023.ssh > cpee0dbd1ce3c00-cme0dbd1ce3bfe.cpe.net.cable.rogers.com.62719: Flags [P.], seq 14812:14848, ack 1, win 1573, length 36
21:37:25.421969 IP comp3134-Winter2023.ssh > cpee0dbd1ce3c00-cme0dbd1ce3bfe.cpe.net.cable.rogers.com.62719: Flags [P.], seq 14848:15052, ack 1, win 1573, length 204
21:37:25.422006 IP comp3134-Winter2023.ssh > cpee0dbd1ce3c00-cme0dbd1ce3bfe.cpe.net.cable.rogers.com.62719: Flags [P.], seq 15052:15088, ack 1, win 1573, length 36
21:37:25.422048 IP comp3134-Winter2023.ssh > cpee0dbd1ce3c00-cme0dbd1ce3bfe.cpe.net.cable.rogers.com.62719: Flags [P.], seq 15088:15292, ack 1, win 1573, length 204
21:37:25.422100 IP comp3134-Winter2023.ssh > cpee0dbd1ce3c00-cme0dbd1ce3bfe.cpe.net.cable.rogers.com.62719: Flags [P.], seq 15292:15532, ack 1, win 1573, length 240
21:37:25.422140 IP comp3134-Winter2023.ssh > cpee0dbd1ce3c00-cme0dbd1ce3bfe.cpe.net.cable.rogers.com.62719: Flags [P.], seq 15532:15568, ack 1, win 1573, length 36
21:37:25.422181 IP comp3134-Winter2023.ssh > cpee0dbd1ce3c00-cme0dbd1ce3bfe.cpe.net.cable.rogers.com.62719: Flags [P.], seq 15568:15772, ack 1, win 1573, length 204
21:37:25.422214 IP comp3134-Winter2023.ssh > cpee0dbd1ce3c00-cme0dbd1ce3bfe.cpe.net.cable.rogers.com.62719: Flags [P.], seq 15772:15808, ack 1, win 1573, length 36
21:37:25.422246 IP comp3134-Winter2023.ssh > cpee0dbd1ce3c00-cme0dbd1ce3bfe.cpe.net.cable.rogers.com.62719: Flags [P.], seq 15808:16012, ack 1, win 1573, length 204
21:37:25.422278 IP comp3134-Winter2023.ssh > cpee0dbd1ce3c00-cme0dbd1ce3bfe.cpe.net.cable.rogers.com.62719: Flags [P.], seq 16012:16048, ack 1, win 1573, length 36
21:37:25.422385 IP comp3134-Winter2023.ssh > cpee0dbd1ce3c00-cme0dbd1ce3bfe.cpe.net.cable.rogers.com.62719: Flags [P.], seq 16048:16252, ack 1, win 1573, length 204
21:37:25.422462 IP comp3134-Winter2023.ssh > cpee0dbd1ce3c00-cme0dbd1ce3bfe.cpe.net.cable.rogers.com.62719: Flags [P.], seq 16252:16288, ack 1, win 1573, length 36
21:37:25.422511 IP comp3134-Winter2023.ssh > cpee0dbd1ce3c00-cme0dbd1ce3bfe.cpe.net.cable.rogers.com.62719: Flags [P.], seq 16288:16492, ack 1, win 1573, length 204
21:37:25.422550 IP comp3134-Winter2023.ssh > cpee0dbd1ce3c00-cme0dbd1ce3bfe.cpe.net.cable.rogers.com.62719: Flags [P.], seq 16492:16528, ack 1, win 1573, length 36
21:37:25.422594 IP comp3134-Winter2023.ssh > cpee0dbd1ce3c00-cme0dbd1ce3bfe.cpe.net.cable.rogers.com.62719: Flags [P.], seq 16528:16732, ack 1, win 1573, length 204
21:37:25.422631 IP comp3134-Winter2023.ssh > cpee0dbd1ce3c00-cme0dbd1ce3bfe.cpe.net.cable.rogers.com.62719: Flags [P.], seq 16732:16768, ack 1, win 1573, length 36
21:37:25.422673 IP comp3134-Winter2023.ssh > cpee0dbd1ce3c00-cme0dbd1ce3bfe.cpe.net.cable.rogers.com.62719: Flags [P.], seq 16768:16972, ack 1, win 1573, length 204
21:37:25.422729 IP comp3134-Winter2023.ssh > cpee0dbd1ce3c00-cme0dbd1ce3bfe.cpe.net.cable.rogers.com.62719: Flags [P.], seq 16972:17212, ack 1, win 1573, length 240
21:37:25.422858 IP comp3134-Winter2023.ssh > cpee0dbd1ce3c00-cme0dbd1ce3bfe.cpe.net.cable.rogers.com.62719: Flags [P.], seq 17212:17728, ack 1, win 1573, length 516
21:37:25.433597 IP cpee0dbd1ce3c00-cme0dbd1ce3bfe.cpe.net.cable.rogers.com.62719 > comp3134-Winter2023.ssh: Flags [.], ack 13372, win 8280, length 0
21:37:25.433674 IP comp3134-Winter2023.ssh > cpee0dbd1ce3c00-cme0dbd1ce3bfe.cpe.net.cable.rogers.com.62719: Flags [P.], seq 17728:20648, ack 1, win 1573, length 2920
21:37:25.433754 IP comp3134-Winter2023.ssh > cpee0dbd1ce3c00-cme0dbd1ce3bfe.cpe.net.cable.rogers.com.62719: Flags [P.], seq 20648:21328, ack 1, win 1573, length 680
21:37:25.433875 IP comp3134-Winter2023.ssh > cpee0dbd1ce3c00-cme0dbd1ce3bfe.cpe.net.cable.rogers.com.62719: Flags [P.], seq 21328:21516, ack 1, win 1573, length 188
21:37:25.433938 IP comp3134-Winter2023.ssh > cpee0dbd1ce3c00-cme0dbd1ce3bfe.cpe.net.cable.rogers.com.62719: Flags [P.], seq 21516:21552, ack 1, win 1573, length 36
21:37:25.433989 IP comp3134-Winter2023.ssh > cpee0dbd1ce3c00-cme0dbd1ce3bfe.cpe.net.cable.rogers.com.62719: Flags [P.], seq 21552:21756, ack 1, win 1573, length 204
21:37:25.434041 IP comp3134-Winter2023.ssh > cpee0dbd1ce3c00-cme0dbd1ce3bfe.cpe.net.cable.rogers.com.62719: Flags [P.], seq 21756:21792, ack 1, win 1573, length 36
21:37:25.434089 IP comp3134-Winter2023.ssh > cpee0dbd1ce3c00-cme0dbd1ce3bfe.cpe.net.cable.rogers.com.62719: Flags [P.], seq 21792:21996, ack 1, win 1573, length 204
21:37:25.434246 IP comp3134-Winter2023.ssh > cpee0dbd1ce3c00-cme0dbd1ce3bfe.cpe.net.cable.rogers.com.62719: Flags [P.], seq 21996:22512, ack 1, win 1573, length 516
21:37:25.434290 IP comp3134-Winter2023.ssh > cpee0dbd1ce3c00-cme0dbd1ce3bfe.cpe.net.cable.rogers.com.62719: Flags [P.], seq 22512:22876, ack 1, win 1573, length 364
21:37:25.434373 IP comp3134-Winter2023.ssh > cpee0dbd1ce3c00-cme0dbd1ce3bfe.cpe.net.cable.rogers.com.62719: Flags [P.], seq 22876:23416, ack 1, win 1573, length 540
21:37:25.434447 IP comp3134-Winter2023.ssh > cpee0dbd1ce3c00-cme0dbd1ce3bfe.cpe.net.cable.rogers.com.62719: Flags [P.], seq 23416:23620, ack 1, win 1573, length 204
21:37:25.434500 IP comp3134-Winter2023.ssh > cpee0dbd1ce3c00-cme0dbd1ce3bfe.cpe.net.cable.rogers.com.62719: Flags [P.], seq 23620:23824, ack 1, win 1573, length 204
21:37:25.434554 IP comp3134-Winter2023.ssh > cpee0dbd1ce3c00-cme0dbd1ce3bfe.cpe.net.cable.rogers.com.62719: Flags [P.], seq 23824:24028, ack 1, win 1573, length 204
21:37:25.434607 IP comp3134-Winter2023.ssh > cpee0dbd1ce3c00-cme0dbd1ce3bfe.cpe.net.cable.rogers.com.62719: Flags [P.], seq 24028:24232, ack 1, win 1573, length 204
21:37:25.434659 IP comp3134-Winter2023.ssh > cpee0dbd1ce3c00-cme0dbd1ce3bfe.cpe.net.cable.rogers.com.62719: Flags [P.], seq 24232:24436, ack 1, win 1573, length 204
21:37:25.434714 IP comp3134-Winter2023.ssh > cpee0dbd1ce3c00-cme0dbd1ce3bfe.cpe.net.cable.rogers.com.62719: Flags [P.], seq 24436:24640, ack 1, win 1573, length 204
21:37:25.434766 IP comp3134-Winter2023.ssh > cpee0dbd1ce3c00-cme0dbd1ce3bfe.cpe.net.cable.rogers.com.62719: Flags [P.], seq 24640:24844, ack 1, win 1573, length 204
21:37:25.434845 IP comp3134-Winter2023.ssh > cpee0dbd1ce3c00-cme0dbd1ce3bfe.cpe.net.cable.rogers.com.62719: Flags [P.], seq 24844:25048, ack 1, win 1573, length 204
21:37:25.434904 IP comp3134-Winter2023.ssh > cpee0dbd1ce3c00-cme0dbd1ce3bfe.cpe.net.cable.rogers.com.62719: Flags [P.], seq 25048:25252, ack 1, win 1573, length 204
21:37:25.434974 IP comp3134-Winter2023.ssh > cpee0dbd1ce3c00-cme0dbd1ce3bfe.cpe.net.cable.rogers.com.62719: Flags [P.], seq 25252:25456, ack 1, win 1573, length 204
21:37:25.435021 IP comp3134-Winter2023.ssh > cpee0dbd1ce3c00-cme0dbd1ce3bfe.cpe.net.cable.rogers.com.62719: Flags [P.], seq 25456:25660, ack 1, win 1573, length 204
21:37:25.435062 IP comp3134-Winter2023.ssh > cpee0dbd1ce3c00-cme0dbd1ce3bfe.cpe.net.cable.rogers.com.62719: Flags [P.], seq 25660:25864, ack 1, win 1573, length 204
21:37:25.435103 IP comp3134-Winter2023.ssh > cpee0dbd1ce3c00-cme0dbd1ce3bfe.cpe.net.cable.rogers.com.62719: Flags [P.], seq 25864:26068, ack 1, win 1573, length 204
21:37:25.435179 IP comp3134-Winter2023.ssh > cpee0dbd1ce3c00-cme0dbd1ce3bfe.cpe.net.cable.rogers.com.62719: Flags [P.], seq 26068:26272, ack 1, win 1573, length 204
21:37:25.435222 IP comp3134-Winter2023.ssh > cpee0dbd1ce3c00-cme0dbd1ce3bfe.cpe.net.cable.rogers.com.62719: Flags [P.], seq 26272:26476, ack 1, win 1573, length 204
21:37:25.459521 IP cpee0dbd1ce3c00-cme0dbd1ce3bfe.cpe.net.cable.rogers.com.62719 > comp3134-Winter2023.ssh: Flags [.], ack 17728, win 8280, length 0
21:37:25.459521 IP cpee0dbd1ce3c00-cme0dbd1ce3bfe.cpe.net.cable.rogers.com.62719 > comp3134-Winter2023.ssh: Flags [.], ack 26476, win 8277, length 0
21:37:25.459593 IP comp3134-Winter2023.ssh > cpee0dbd1ce3c00-cme0dbd1ce3bfe.cpe.net.cable.rogers.com.62719: Flags [P.], seq 26476:26680, ack 1, win 1573, length 204
21:37:25.459810 IP comp3134-Winter2023.ssh > cpee0dbd1ce3c00-cme0dbd1ce3bfe.cpe.net.cable.rogers.com.62719: Flags [P.], seq 26680:27180, ack 1, win 1573, length 500
21:37:25.459873 IP comp3134-Winter2023.ssh > cpee0dbd1ce3c00-cme0dbd1ce3bfe.cpe.net.cable.rogers.com.62719: Flags [P.], seq 27180:27384, ack 1, win 1573, length 204
21:37:25.459923 IP comp3134-Winter2023.ssh > cpee0dbd1ce3c00-cme0dbd1ce3bfe.cpe.net.cable.rogers.com.62719: Flags [P.], seq 27384:27588, ack 1, win 1573, length 204
21:37:25.460121 IP comp3134-Winter2023.ssh > cpee0dbd1ce3c00-cme0dbd1ce3bfe.cpe.net.cable.rogers.com.62719: Flags [P.], seq 27588:27792, ack 1, win 1573, length 204
21:37:25.460194 IP comp3134-Winter2023.ssh > cpee0dbd1ce3c00-cme0dbd1ce3bfe.cpe.net.cable.rogers.com.62719: Flags [P.], seq 27792:27996, ack 1, win 1573, length 204
21:37:25.460243 IP comp3134-Winter2023.ssh > cpee0dbd1ce3c00-cme0dbd1ce3bfe.cpe.net.cable.rogers.com.62719: Flags [P.], seq 27996:28200, ack 1, win 1573, length 204
21:37:25.460294 IP comp3134-Winter2023.ssh > cpee0dbd1ce3c00-cme0dbd1ce3bfe.cpe.net.cable.rogers.com.62719: Flags [P.], seq 28200:28404, ack 1, win 1573, length 204
21:37:25.460342 IP comp3134-Winter2023.ssh > cpee0dbd1ce3c00-cme0dbd1ce3bfe.cpe.net.cable.rogers.com.62719: Flags [P.], seq 28404:28608, ack 1, win 1573, length 204
21:37:25.460383 IP comp3134-Winter2023.ssh > cpee0dbd1ce3c00-cme0dbd1ce3bfe.cpe.net.cable.rogers.com.62719: Flags [P.], seq 28608:28812, ack 1, win 1573, length 204
21:37:25.460435 IP comp3134-Winter2023.ssh > cpee0dbd1ce3c00-cme0dbd1ce3bfe.cpe.net.cable.rogers.com.62719: Flags [P.], seq 28812:29016, ack 1, win 1573, length 204
21:37:25.460503 IP comp3134-Winter2023.ssh > cpee0dbd1ce3c00-cme0dbd1ce3bfe.cpe.net.cable.rogers.com.62719: Flags [P.], seq 29016:29220, ack 1, win 1573, length 204
21:37:25.460558 IP comp3134-Winter2023.ssh > cpee0dbd1ce3c00-cme0dbd1ce3bfe.cpe.net.cable.rogers.com.62719: Flags [P.], seq 29220:29424, ack 1, win 1573, length 204
21:37:25.460683 IP comp3134-Winter2023.ssh > cpee0dbd1ce3c00-cme0dbd1ce3bfe.cpe.net.cable.rogers.com.62719: Flags [P.], seq 29424:29628, ack 1, win 1573, length 204
21:37:25.460780 IP comp3134-Winter2023.ssh > cpee0dbd1ce3c00-cme0dbd1ce3bfe.cpe.net.cable.rogers.com.62719: Flags [P.], seq 29628:29832, ack 1, win 1573, length 204
21:37:25.460825 IP comp3134-Winter2023.ssh > cpee0dbd1ce3c00-cme0dbd1ce3bfe.cpe.net.cable.rogers.com.62719: Flags [P.], seq 29832:30036, ack 1, win 1573, length 204
21:37:25.460865 IP comp3134-Winter2023.ssh > cpee0dbd1ce3c00-cme0dbd1ce3bfe.cpe.net.cable.rogers.com.62719: Flags [P.], seq 30036:30240, ack 1, win 1573, length 204
21:37:25.460929 IP comp3134-Winter2023.ssh > cpee0dbd1ce3c00-cme0dbd1ce3bfe.cpe.net.cable.rogers.com.62719: Flags [P.], seq 30240:30444, ack 1, win 1573, length 204
21:37:25.461071 IP comp3134-Winter2023.ssh > cpee0dbd1ce3c00-cme0dbd1ce3bfe.cpe.net.cable.rogers.com.62719: Flags [P.], seq 30444:30648, ack 1, win 1573, length 204
21:37:25.461120 IP comp3134-Winter2023.ssh > cpee0dbd1ce3c00-cme0dbd1ce3bfe.cpe.net.cable.rogers.com.62719: Flags [P.], seq 30648:30852, ack 1, win 1573, length 204
21:37:25.461163 IP comp3134-Winter2023.ssh > cpee0dbd1ce3c00-cme0dbd1ce3bfe.cpe.net.cable.rogers.com.62719: Flags [P.], seq 30852:31056, ack 1, win 1573, length 204
21:37:25.461206 IP comp3134-Winter2023.ssh > cpee0dbd1ce3c00-cme0dbd1ce3bfe.cpe.net.cable.rogers.com.62719: Flags [P.], seq 31056:31260, ack 1, win 1573, length 204
21:37:25.461252 IP comp3134-Winter2023.ssh > cpee0dbd1ce3c00-cme0dbd1ce3bfe.cpe.net.cable.rogers.com.62719: Flags [P.], seq 31260:31464, ack 1, win 1573, length 204
21:37:25.461303 IP comp3134-Winter2023.ssh > cpee0dbd1ce3c00-cme0dbd1ce3bfe.cpe.net.cable.rogers.com.62719: Flags [P.], seq 31464:31668, ack 1, win 1573, length 204
21:37:25.461349 IP comp3134-Winter2023.ssh > cpee0dbd1ce3c00-cme0dbd1ce3bfe.cpe.net.cable.rogers.com.62719: Flags [P.], seq 31668:31872, ack 1, win 1573, length 204
21:37:25.461388 IP comp3134-Winter2023.ssh > cpee0dbd1ce3c00-cme0dbd1ce3bfe.cpe.net.cable.rogers.com.62719: Flags [P.], seq 31872:32076, ack 1, win 1573, length 204
21:37:25.461425 IP comp3134-Winter2023.ssh > cpee0dbd1ce3c00-cme0dbd1ce3bfe.cpe.net.cable.rogers.com.62719: Flags [P.], seq 32076:32280, ack 1, win 1573, length 204
21:37:25.461463 IP comp3134-Winter2023.ssh > cpee0dbd1ce3c00-cme0dbd1ce3bfe.cpe.net.cable.rogers.com.62719: Flags [P.], seq 32280:32484, ack 1, win 1573, length 204
21:37:25.461505 IP comp3134-Winter2023.ssh > cpee0dbd1ce3c00-cme0dbd1ce3bfe.cpe.net.cable.rogers.com.62719: Flags [P.], seq 32484:32688, ack 1, win 1573, length 204
21:37:25.461553 IP comp3134-Winter2023.ssh > cpee0dbd1ce3c00-cme0dbd1ce3bfe.cpe.net.cable.rogers.com.62719: Flags [P.], seq 32688:32892, ack 1, win 1573, length 204
21:37:25.461606 IP comp3134-Winter2023.ssh > cpee0dbd1ce3c00-cme0dbd1ce3bfe.cpe.net.cable.rogers.com.62719: Flags [P.], seq 32892:33096, ack 1, win 1573, length 204
21:37:25.461654 IP comp3134-Winter2023.ssh > cpee0dbd1ce3c00-cme0dbd1ce3bfe.cpe.net.cable.rogers.com.62719: Flags [P.], seq 33096:33300, ack 1, win 1573, length 204
21:37:25.461699 IP comp3134-Winter2023.ssh > cpee0dbd1ce3c00-cme0dbd1ce3bfe.cpe.net.cable.rogers.com.62719: Flags [P.], seq 33300:33504, ack 1, win 1573, length 204
21:37:25.461759 IP comp3134-Winter2023.ssh > cpee0dbd1ce3c00-cme0dbd1ce3bfe.cpe.net.cable.rogers.com.62719: Flags [P.], seq 33504:33708, ack 1, win 1573, length 204
21:37:25.461799 IP comp3134-Winter2023.ssh > cpee0dbd1ce3c00-cme0dbd1ce3bfe.cpe.net.cable.rogers.com.62719: Flags [P.], seq 33708:33912, ack 1, win 1573, length 204
21:37:25.461837 IP comp3134-Winter2023.ssh > cpee0dbd1ce3c00-cme0dbd1ce3bfe.cpe.net.cable.rogers.com.62719: Flags [P.], seq 33912:34116, ack 1, win 1573, length 204
21:37:25.461898 IP comp3134-Winter2023.ssh > cpee0dbd1ce3c00-cme0dbd1ce3bfe.cpe.net.cable.rogers.com.62719: Flags [P.], seq 34116:34320, ack 1, win 1573, length 204
21:37:25.461943 IP comp3134-Winter2023.ssh > cpee0dbd1ce3c00-cme0dbd1ce3bfe.cpe.net.cable.rogers.com.62719: Flags [P.], seq 34320:34524, ack 1, win 1573, length 204
21:37:25.461989 IP comp3134-Winter2023.ssh > cpee0dbd1ce3c00-cme0dbd1ce3bfe.cpe.net.cable.rogers.com.62719: Flags [P.], seq 34524:34728, ack 1, win 1573, length 204
21:37:25.462027 IP comp3134-Winter2023.ssh > cpee0dbd1ce3c00-cme0dbd1ce3bfe.cpe.net.cable.rogers.com.62719: Flags [P.], seq 34728:34932, ack 1, win 1573, length 204
21:37:25.462065 IP comp3134-Winter2023.ssh > cpee0dbd1ce3c00-cme0dbd1ce3bfe.cpe.net.cable.rogers.com.62719: Flags [P.], seq 34932:35136, ack 1, win 1573, length 204
21:37:25.462106 IP comp3134-Winter2023.ssh > cpee0dbd1ce3c00-cme0dbd1ce3bfe.cpe.net.cable.rogers.com.62719: Flags [P.], seq 35136:35340, ack 1, win 1573, length 204
21:37:25.462172 IP comp3134-Winter2023.ssh > cpee0dbd1ce3c00-cme0dbd1ce3bfe.cpe.net.cable.rogers.com.62719: Flags [P.], seq 35340:35544, ack 1, win 1573, length 204
21:37:25.462221 IP comp3134-Winter2023.ssh > cpee0dbd1ce3c00-cme0dbd1ce3bfe.cpe.net.cable.rogers.com.62719: Flags [P.], seq 35544:35748, ack 1, win 1573, length 204
21:37:25.462275 IP comp3134-Winter2023.ssh > cpee0dbd1ce3c00-cme0dbd1ce3bfe.cpe.net.cable.rogers.com.62719: Flags [P.], seq 35748:35952, ack 1, win 1573, length 204
21:37:25.462368 IP comp3134-Winter2023.ssh > cpee0dbd1ce3c00-cme0dbd1ce3bfe.cpe.net.cable.rogers.com.62719: Flags [P.], seq 35952:36156, ack 1, win 1573, length 204
21:37:25.462424 IP comp3134-Winter2023.ssh > cpee0dbd1ce3c00-cme0dbd1ce3bfe.cpe.net.cable.rogers.com.62719: Flags [P.], seq 36156:36360, ack 1, win 1573, length 204
21:37:25.462465 IP comp3134-Winter2023.ssh > cpee0dbd1ce3c00-cme0dbd1ce3bfe.cpe.net.cable.rogers.com.62719: Flags [P.], seq 36360:36564, ack 1, win 1573, length 204
21:37:25.462514 IP comp3134-Winter2023.ssh > cpee0dbd1ce3c00-cme0dbd1ce3bfe.cpe.net.cable.rogers.com.62719: Flags [P.], seq 36564:36768, ack 1, win 1573, length 204
21:37:25.462567 IP comp3134-Winter2023.ssh > cpee0dbd1ce3c00-cme0dbd1ce3bfe.cpe.net.cable.rogers.com.62719: Flags [P.], seq 36768:36972, ack 1, win 1573, length 204
21:37:25.462609 IP comp3134-Winter2023.ssh > cpee0dbd1ce3c00-cme0dbd1ce3bfe.cpe.net.cable.rogers.com.62719: Flags [P.], seq 36972:37176, ack 1, win 1573, length 204
21:37:25.462675 IP comp3134-Winter2023.ssh > cpee0dbd1ce3c00-cme0dbd1ce3bfe.cpe.net.cable.rogers.com.62719: Flags [P.], seq 37176:37380, ack 1, win 1573, length 204
21:37:25.462722 IP comp3134-Winter2023.ssh > cpee0dbd1ce3c00-cme0dbd1ce3bfe.cpe.net.cable.rogers.com.62719: Flags [P.], seq 37380:37584, ack 1, win 1573, length 204
21:37:25.462761 IP comp3134-Winter2023.ssh > cpee0dbd1ce3c00-cme0dbd1ce3bfe.cpe.net.cable.rogers.com.62719: Flags [P.], seq 37584:37788, ack 1, win 1573, length 204
21:37:25.462799 IP comp3134-Winter2023.ssh > cpee0dbd1ce3c00-cme0dbd1ce3bfe.cpe.net.cable.rogers.com.62719: Flags [P.], seq 37788:37992, ack 1, win 1573, length 204
21:37:25.462837 IP comp3134-Winter2023.ssh > cpee0dbd1ce3c00-cme0dbd1ce3bfe.cpe.net.cable.rogers.com.62719: Flags [P.], seq 37992:38196, ack 1, win 1573, length 204
21:37:25.462874 IP comp3134-Winter2023.ssh > cpee0dbd1ce3c00-cme0dbd1ce3bfe.cpe.net.cable.rogers.com.62719: Flags [P.], seq 38196:38400, ack 1, win 1573, length 204
21:37:25.462910 IP comp3134-Winter2023.ssh > cpee0dbd1ce3c00-cme0dbd1ce3bfe.cpe.net.cable.rogers.com.62719: Flags [P.], seq 38400:38604, ack 1, win 1573, length 204
21:37:25.462947 IP comp3134-Winter2023.ssh > cpee0dbd1ce3c00-cme0dbd1ce3bfe.cpe.net.cable.rogers.com.62719: Flags [P.], seq 38604:38808, ack 1, win 1573, length 204
21:37:25.463013 IP comp3134-Winter2023.ssh > cpee0dbd1ce3c00-cme0dbd1ce3bfe.cpe.net.cable.rogers.com.62719: Flags [P.], seq 38808:39012, ack 1, win 1573, length 204
21:37:25.463111 IP comp3134-Winter2023.ssh > cpee0dbd1ce3c00-cme0dbd1ce3bfe.cpe.net.cable.rogers.com.62719: Flags [P.], seq 39012:39216, ack 1, win 1573, length 204
21:37:25.463159 IP comp3134-Winter2023.ssh > cpee0dbd1ce3c00-cme0dbd1ce3bfe.cpe.net.cable.rogers.com.62719: Flags [P.], seq 39216:39420, ack 1, win 1573, length 204
21:37:25.463203 IP comp3134-Winter2023.ssh > cpee0dbd1ce3c00-cme0dbd1ce3bfe.cpe.net.cable.rogers.com.62719: Flags [P.], seq 39420:39624, ack 1, win 1573, length 204
21:37:25.463242 IP comp3134-Winter2023.ssh > cpee0dbd1ce3c00-cme0dbd1ce3bfe.cpe.net.cable.rogers.com.62719: Flags [P.], seq 39624:39828, ack 1, win 1573, length 204
21:37:25.463285 IP comp3134-Winter2023.ssh > cpee0dbd1ce3c00-cme0dbd1ce3bfe.cpe.net.cable.rogers.com.62719: Flags [P.], seq 39828:40032, ack 1, win 1573, length 204
21:37:25.463322 IP comp3134-Winter2023.ssh > cpee0dbd1ce3c00-cme0dbd1ce3bfe.cpe.net.cable.rogers.com.62719: Flags [P.], seq 40032:40236, ack 1, win 1573, length 204
21:37:25.463381 IP comp3134-Winter2023.ssh > cpee0dbd1ce3c00-cme0dbd1ce3bfe.cpe.net.cable.rogers.com.62719: Flags [P.], seq 40236:40440, ack 1, win 1573, length 204
21:37:25.463430 IP comp3134-Winter2023.ssh > cpee0dbd1ce3c00-cme0dbd1ce3bfe.cpe.net.cable.rogers.com.62719: Flags [P.], seq 40440:40644, ack 1, win 1573, length 204
21:37:25.463479 IP comp3134-Winter2023.ssh > cpee0dbd1ce3c00-cme0dbd1ce3bfe.cpe.net.cable.rogers.com.62719: Flags [P.], seq 40644:40848, ack 1, win 1573, length 204
21:37:25.463538 IP comp3134-Winter2023.ssh > cpee0dbd1ce3c00-cme0dbd1ce3bfe.cpe.net.cable.rogers.com.62719: Flags [P.], seq 40848:41052, ack 1, win 1573, length 204
21:37:25.463580 IP comp3134-Winter2023.ssh > cpee0dbd1ce3c00-cme0dbd1ce3bfe.cpe.net.cable.rogers.com.62719: Flags [P.], seq 41052:41256, ack 1, win 1573, length 204
21:37:25.463620 IP comp3134-Winter2023.ssh > cpee0dbd1ce3c00-cme0dbd1ce3bfe.cpe.net.cable.rogers.com.62719: Flags [P.], seq 41256:41460, ack 1, win 1573, length 204
21:37:25.463658 IP comp3134-Winter2023.ssh > cpee0dbd1ce3c00-cme0dbd1ce3bfe.cpe.net.cable.rogers.com.62719: Flags [P.], seq 41460:41664, ack 1, win 1573, length 204
21:37:25.463695 IP comp3134-Winter2023.ssh > cpee0dbd1ce3c00-cme0dbd1ce3bfe.cpe.net.cable.rogers.com.62719: Flags [P.], seq 41664:41868, ack 1, win 1573, length 204
21:37:25.463773 IP comp3134-Winter2023.ssh > cpee0dbd1ce3c00-cme0dbd1ce3bfe.cpe.net.cable.rogers.com.62719: Flags [P.], seq 41868:42072, ack 1, win 1573, length 204
21:37:25.463820 IP comp3134-Winter2023.ssh > cpee0dbd1ce3c00-cme0dbd1ce3bfe.cpe.net.cable.rogers.com.62719: Flags [P.], seq 42072:42276, ack 1, win 1573, length 204
21:37:25.463871 IP comp3134-Winter2023.ssh > cpee0dbd1ce3c00-cme0dbd1ce3bfe.cpe.net.cable.rogers.com.62719: Flags [P.], seq 42276:42480, ack 1, win 1573, length 204
21:37:25.463911 IP comp3134-Winter2023.ssh > cpee0dbd1ce3c00-cme0dbd1ce3bfe.cpe.net.cable.rogers.com.62719: Flags [P.], seq 42480:42684, ack 1, win 1573, length 204
21:37:25.463947 IP comp3134-Winter2023.ssh > cpee0dbd1ce3c00-cme0dbd1ce3bfe.cpe.net.cable.rogers.com.62719: Flags [P.], seq 42684:42888, ack 1, win 1573, length 204
21:37:25.464159 IP comp3134-Winter2023.ssh > cpee0dbd1ce3c00-cme0dbd1ce3bfe.cpe.net.cable.rogers.com.62719: Flags [P.], seq 42888:43092, ack 1, win 1573, length 204
21:37:25.464290 IP comp3134-Winter2023.ssh > cpee0dbd1ce3c00-cme0dbd1ce3bfe.cpe.net.cable.rogers.com.62719: Flags [P.], seq 43092:43296, ack 1, win 1573, length 204
21:37:25.464347 IP comp3134-Winter2023.ssh > cpee0dbd1ce3c00-cme0dbd1ce3bfe.cpe.net.cable.rogers.com.62719: Flags [P.], seq 43296:43500, ack 1, win 1573, length 204
21:37:25.464389 IP comp3134-Winter2023.ssh > cpee0dbd1ce3c00-cme0dbd1ce3bfe.cpe.net.cable.rogers.com.62719: Flags [P.], seq 43500:43704, ack 1, win 1573, length 204
21:37:25.464427 IP comp3134-Winter2023.ssh > cpee0dbd1ce3c00-cme0dbd1ce3bfe.cpe.net.cable.rogers.com.62719: Flags [P.], seq 43704:43908, ack 1, win 1573, length 204
21:37:25.464465 IP comp3134-Winter2023.ssh > cpee0dbd1ce3c00-cme0dbd1ce3bfe.cpe.net.cable.rogers.com.62719: Flags [P.], seq 43908:44112, ack 1, win 1573, length 204
21:37:25.464503 IP comp3134-Winter2023.ssh > cpee0dbd1ce3c00-cme0dbd1ce3bfe.cpe.net.cable.rogers.com.62719: Flags [P.], seq 44112:44316, ack 1, win 1573, length 204
21:37:25.464539 IP comp3134-Winter2023.ssh > cpee0dbd1ce3c00-cme0dbd1ce3bfe.cpe.net.cable.rogers.com.62719: Flags [P.], seq 44316:44520, ack 1, win 1573, length 204
21:37:25.464581 IP comp3134-Winter2023.ssh > cpee0dbd1ce3c00-cme0dbd1ce3bfe.cpe.net.cable.rogers.com.62719: Flags [P.], seq 44520:44724, ack 1, win 1573, length 204
21:37:25.464620 IP comp3134-Winter2023.ssh > cpee0dbd1ce3c00-cme0dbd1ce3bfe.cpe.net.cable.rogers.com.62719: Flags [P.], seq 44724:44928, ack 1, win 1573, length 204
21:37:25.464662 IP comp3134-Winter2023.ssh > cpee0dbd1ce3c00-cme0dbd1ce3bfe.cpe.net.cable.rogers.com.62719: Flags [P.], seq 44928:45132, ack 1, win 1573, length 204
21:37:25.464699 IP comp3134-Winter2023.ssh > cpee0dbd1ce3c00-cme0dbd1ce3bfe.cpe.net.cable.rogers.com.62719: Flags [P.], seq 45132:45336, ack 1, win 1573, length 204
21:37:25.464763 IP comp3134-Winter2023.ssh > cpee0dbd1ce3c00-cme0dbd1ce3bfe.cpe.net.cable.rogers.com.62719: Flags [P.], seq 45336:45540, ack 1, win 1573, length 204
21:37:25.464814 IP comp3134-Winter2023.ssh > cpee0dbd1ce3c00-cme0dbd1ce3bfe.cpe.net.cable.rogers.com.62719: Flags [P.], seq 45540:45744, ack 1, win 1573, length 204
21:37:25.464853 IP comp3134-Winter2023.ssh > cpee0dbd1ce3c00-cme0dbd1ce3bfe.cpe.net.cable.rogers.com.62719: Flags [P.], seq 45744:45948, ack 1, win 1573, length 204
21:37:25.464898 IP comp3134-Winter2023.ssh > cpee0dbd1ce3c00-cme0dbd1ce3bfe.cpe.net.cable.rogers.com.62719: Flags [P.], seq 45948:46152, ack 1, win 1573, length 204
21:37:25.464947 IP comp3134-Winter2023.ssh > cpee0dbd1ce3c00-cme0dbd1ce3bfe.cpe.net.cable.rogers.com.62719: Flags [P.], seq 46152:46356, ack 1, win 1573, length 204
21:37:25.464995 IP comp3134-Winter2023.ssh > cpee0dbd1ce3c00-cme0dbd1ce3bfe.cpe.net.cable.rogers.com.62719: Flags [P.], seq 46356:46560, ack 1, win 1573, length 204
21:37:25.465330 IP comp3134-Winter2023.ssh > cpee0dbd1ce3c00-cme0dbd1ce3bfe.cpe.net.cable.rogers.com.62719: Flags [P.], seq 46560:46764, ack 1, win 1573, length 204
21:37:25.465419 IP comp3134-Winter2023.ssh > cpee0dbd1ce3c00-cme0dbd1ce3bfe.cpe.net.cable.rogers.com.62719: Flags [P.], seq 46764:46968, ack 1, win 1573, length 204
21:37:25.465476 IP comp3134-Winter2023.ssh > cpee0dbd1ce3c00-cme0dbd1ce3bfe.cpe.net.cable.rogers.com.62719: Flags [P.], seq 46968:47172, ack 1, win 1573, length 204
21:37:25.465533 IP comp3134-Winter2023.ssh > cpee0dbd1ce3c00-cme0dbd1ce3bfe.cpe.net.cable.rogers.com.62719: Flags [P.], seq 47172:47376, ack 1, win 1573, length 204
21:37:25.465586 IP comp3134-Winter2023.ssh > cpee0dbd1ce3c00-cme0dbd1ce3bfe.cpe.net.cable.rogers.com.62719: Flags [P.], seq 47376:47580, ack 1, win 1573, length 204
21:37:25.465754 IP comp3134-Winter2023.ssh > cpee0dbd1ce3c00-cme0dbd1ce3bfe.cpe.net.cable.rogers.com.62719: Flags [P.], seq 47580:47784, ack 1, win 1573, length 204
21:37:25.465933 IP comp3134-Winter2023.ssh > cpee0dbd1ce3c00-cme0dbd1ce3bfe.cpe.net.cable.rogers.com.62719: Flags [P.], seq 47784:47988, ack 1, win 1573, length 204
21:37:25.466005 IP comp3134-Winter2023.ssh > cpee0dbd1ce3c00-cme0dbd1ce3bfe.cpe.net.cable.rogers.com.62719: Flags [P.], seq 47988:48192, ack 1, win 1573, length 204
21:37:25.466064 IP comp3134-Winter2023.ssh > cpee0dbd1ce3c00-cme0dbd1ce3bfe.cpe.net.cable.rogers.com.62719: Flags [P.], seq 48192:48396, ack 1, win 1573, length 204
21:37:25.491877 IP cpee0dbd1ce3c00-cme0dbd1ce3bfe.cpe.net.cable.rogers.com.62719 > comp3134-Winter2023.ssh: Flags [.], ack 39828, win 8280, length 0
21:37:25.491878 IP cpee0dbd1ce3c00-cme0dbd1ce3bfe.cpe.net.cable.rogers.com.62719 > comp3134-Winter2023.ssh: Flags [.], ack 48396, win 8280, length 0
21:37:25.492132 IP comp3134-Winter2023.ssh > cpee0dbd1ce3c00-cme0dbd1ce3bfe.cpe.net.cable.rogers.com.62719: Flags [P.], seq 48396:48600, ack 1, win 1573, length 204
21:37:25.492383 IP comp3134-Winter2023.ssh > cpee0dbd1ce3c00-cme0dbd1ce3bfe.cpe.net.cable.rogers.com.62719: Flags [P.], seq 48600:49100, ack 1, win 1573, length 500
21:37:25.492469 IP comp3134-Winter2023.ssh > cpee0dbd1ce3c00-cme0dbd1ce3bfe.cpe.net.cable.rogers.com.62719: Flags [P.], seq 49100:49304, ack 1, win 1573, length 204
21:37:25.492512 IP comp3134-Winter2023.ssh > cpee0dbd1ce3c00-cme0dbd1ce3bfe.cpe.net.cable.rogers.com.62719: Flags [P.], seq 49304:49508, ack 1, win 1573, length 204
21:37:25.492564 IP comp3134-Winter2023.ssh > cpee0dbd1ce3c00-cme0dbd1ce3bfe.cpe.net.cable.rogers.com.62719: Flags [P.], seq 49508:49712, ack 1, win 1573, length 204
21:37:25.492618 IP comp3134-Winter2023.ssh > cpee0dbd1ce3c00-cme0dbd1ce3bfe.cpe.net.cable.rogers.com.62719: Flags [P.], seq 49712:49916, ack 1, win 1573, length 204
21:37:25.492733 IP comp3134-Winter2023.ssh > cpee0dbd1ce3c00-cme0dbd1ce3bfe.cpe.net.cable.rogers.com.62719: Flags [P.], seq 49916:50120, ack 1, win 1573, length 204
21:37:25.492774 IP comp3134-Winter2023.ssh > cpee0dbd1ce3c00-cme0dbd1ce3bfe.cpe.net.cable.rogers.com.62719: Flags [P.], seq 50120:50324, ack 1, win 1573, length 204
21:37:25.492820 IP comp3134-Winter2023.ssh > cpee0dbd1ce3c00-cme0dbd1ce3bfe.cpe.net.cable.rogers.com.62719: Flags [P.], seq 50324:50528, ack 1, win 1573, length 204
21:37:25.492870 IP comp3134-Winter2023.ssh > cpee0dbd1ce3c00-cme0dbd1ce3bfe.cpe.net.cable.rogers.com.62719: Flags [P.], seq 50528:50732, ack 1, win 1573, length 204
21:37:25.492922 IP comp3134-Winter2023.ssh > cpee0dbd1ce3c00-cme0dbd1ce3bfe.cpe.net.cable.rogers.com.62719: Flags [P.], seq 50732:50936, ack 1, win 1573, length 204
21:37:25.492979 IP comp3134-Winter2023.ssh > cpee0dbd1ce3c00-cme0dbd1ce3bfe.cpe.net.cable.rogers.com.62719: Flags [P.], seq 50936:51140, ack 1, win 1573, length 204
21:37:25.493034 IP comp3134-Winter2023.ssh > cpee0dbd1ce3c00-cme0dbd1ce3bfe.cpe.net.cable.rogers.com.62719: Flags [P.], seq 51140:51344, ack 1, win 1573, length 204
21:37:25.493074 IP comp3134-Winter2023.ssh > cpee0dbd1ce3c00-cme0dbd1ce3bfe.cpe.net.cable.rogers.com.62719: Flags [P.], seq 51344:51548, ack 1, win 1573, length 204
21:37:25.493112 IP comp3134-Winter2023.ssh > cpee0dbd1ce3c00-cme0dbd1ce3bfe.cpe.net.cable.rogers.com.62719: Flags [P.], seq 51548:51752, ack 1, win 1573, length 204
21:37:25.493150 IP comp3134-Winter2023.ssh > cpee0dbd1ce3c00-cme0dbd1ce3bfe.cpe.net.cable.rogers.com.62719: Flags [P.], seq 51752:51956, ack 1, win 1573, length 204
21:37:25.493188 IP comp3134-Winter2023.ssh > cpee0dbd1ce3c00-cme0dbd1ce3bfe.cpe.net.cable.rogers.com.62719: Flags [P.], seq 51956:52160, ack 1, win 1573, length 204
21:37:25.493226 IP comp3134-Winter2023.ssh > cpee0dbd1ce3c00-cme0dbd1ce3bfe.cpe.net.cable.rogers.com.62719: Flags [P.], seq 52160:52364, ack 1, win 1573, length 204
21:37:25.493264 IP comp3134-Winter2023.ssh > cpee0dbd1ce3c00-cme0dbd1ce3bfe.cpe.net.cable.rogers.com.62719: Flags [P.], seq 52364:52568, ack 1, win 1573, length 204
21:37:25.493301 IP comp3134-Winter2023.ssh > cpee0dbd1ce3c00-cme0dbd1ce3bfe.cpe.net.cable.rogers.com.62719: Flags [P.], seq 52568:52772, ack 1, win 1573, length 204
