root@comp3134-Winter2023:~# tcpdump -i eth0 tcp
tcpdump: verbose output suppressed, use -v or -vv for full protocol decode
listening on eth0, link-type EN10MB (Ethernet), capture size 262144 bytes
00:57:03.794980 IP comp3134-Winter2023.ssh > cpee0dbd1ce3c00-cme0dbd1ce3bfe.cpe.net.cable.rogers.com.62719: Flags [P.], seq 3840160033:3840160141, ack 3247800208, win 1573, length 108
00:57:03.795083 IP comp3134-Winter2023.ssh > cpee0dbd1ce3c00-cme0dbd1ce3bfe.cpe.net.cable.rogers.com.62719: Flags [P.], seq 108:252, ack 1, win 1573, length 144
00:57:03.795123 IP comp3134-Winter2023.ssh > cpee0dbd1ce3c00-cme0dbd1ce3bfe.cpe.net.cable.rogers.com.62719: Flags [P.], seq 252:288, ack 1, win 1573, length 36
00:57:03.797918 IP comp3134-Winter2023.ssh > cpee0dbd1ce3c00-cme0dbd1ce3bfe.cpe.net.cable.rogers.com.62719: Flags [P.], seq 288:508, ack 1, win 1573, length 220
00:57:03.798004 IP comp3134-Winter2023.ssh > cpee0dbd1ce3c00-cme0dbd1ce3bfe.cpe.net.cable.rogers.com.62719: Flags [P.], seq 508:544, ack 1, win 1573, length 36
00:57:03.798019 IP comp3134-Winter2023.ssh > cpee0dbd1ce3c00-cme0dbd1ce3bfe.cpe.net.cable.rogers.com.62719: Flags [P.], seq 544:740, ack 1, win 1573, length 196
00:57:03.798061 IP comp3134-Winter2023.ssh > cpee0dbd1ce3c00-cme0dbd1ce3bfe.cpe.net.cable.rogers.com.62719: Flags [P.], seq 740:776, ack 1, win 1573, length 36
00:57:03.798111 IP comp3134-Winter2023.ssh > cpee0dbd1ce3c00-cme0dbd1ce3bfe.cpe.net.cable.rogers.com.62719: Flags [P.], seq 776:972, ack 1, win 1573, length 196
00:57:03.798177 IP comp3134-Winter2023.ssh > cpee0dbd1ce3c00-cme0dbd1ce3bfe.cpe.net.cable.rogers.com.62719: Flags [P.], seq 972:1008, ack 1, win 1573, length 36
00:57:03.815401 IP cpee0dbd1ce3c00-cme0dbd1ce3bfe.cpe.net.cable.rogers.com.62719 > comp3134-Winter2023.ssh: Flags [.], ack 288, win 8277, length 0
00:57:03.815502 IP comp3134-Winter2023.ssh > cpee0dbd1ce3c00-cme0dbd1ce3bfe.cpe.net.cable.rogers.com.62719: Flags [P.], seq 1008:2400, ack 1, win 1573, length 1392
00:57:03.815728 IP comp3134-Winter2023.ssh > cpee0dbd1ce3c00-cme0dbd1ce3bfe.cpe.net.cable.rogers.com.62719: Flags [P.], seq 2400:2580, ack 1, win 1573, length 180
00:57:03.815777 IP comp3134-Winter2023.ssh > cpee0dbd1ce3c00-cme0dbd1ce3bfe.cpe.net.cable.rogers.com.62719: Flags [P.], seq 2580:2616, ack 1, win 1573, length 36
00:57:03.815823 IP comp3134-Winter2023.ssh > cpee0dbd1ce3c00-cme0dbd1ce3bfe.cpe.net.cable.rogers.com.62719: Flags [P.], seq 2616:2820, ack 1, win 1573, length 204
00:57:03.815898 IP comp3134-Winter2023.ssh > cpee0dbd1ce3c00-cme0dbd1ce3bfe.cpe.net.cable.rogers.com.62719: Flags [P.], seq 2820:3052, ack 1, win 1573, length 232
00:57:03.815930 IP comp3134-Winter2023.ssh > cpee0dbd1ce3c00-cme0dbd1ce3bfe.cpe.net.cable.rogers.com.62719: Flags [P.], seq 3052:3088, ack 1, win 1573, length 36
00:57:03.815971 IP comp3134-Winter2023.ssh > cpee0dbd1ce3c00-cme0dbd1ce3bfe.cpe.net.cable.rogers.com.62719: Flags [P.], seq 3088:3284, ack 1, win 1573, length 196
00:57:03.816008 IP comp3134-Winter2023.ssh > cpee0dbd1ce3c00-cme0dbd1ce3bfe.cpe.net.cable.rogers.com.62719: Flags [P.], seq 3284:3320, ack 1, win 1573, length 36
00:57:03.824033 IP cpee0dbd1ce3c00-cme0dbd1ce3bfe.cpe.net.cable.rogers.com.62719 > comp3134-Winter2023.ssh: Flags [.], ack 1008, win 8280, length 0
00:57:03.824105 IP comp3134-Winter2023.ssh > cpee0dbd1ce3c00-cme0dbd1ce3bfe.cpe.net.cable.rogers.com.62719: Flags [P.], seq 3320:4480, ack 1, win 1573, length 1160
00:57:03.824399 IP comp3134-Winter2023.ssh > cpee0dbd1ce3c00-cme0dbd1ce3bfe.cpe.net.cable.rogers.com.62719: Flags [P.], seq 4480:4668, ack 1, win 1573, length 188
00:57:03.824451 IP comp3134-Winter2023.ssh > cpee0dbd1ce3c00-cme0dbd1ce3bfe.cpe.net.cable.rogers.com.62719: Flags [P.], seq 4668:4704, ack 1, win 1573, length 36
00:57:03.824499 IP comp3134-Winter2023.ssh > cpee0dbd1ce3c00-cme0dbd1ce3bfe.cpe.net.cable.rogers.com.62719: Flags [P.], seq 4704:4908, ack 1, win 1573, length 204
00:57:03.824540 IP comp3134-Winter2023.ssh > cpee0dbd1ce3c00-cme0dbd1ce3bfe.cpe.net.cable.rogers.com.62719: Flags [P.], seq 4908:4944, ack 1, win 1573, length 36
00:57:03.824642 IP comp3134-Winter2023.ssh > cpee0dbd1ce3c00-cme0dbd1ce3bfe.cpe.net.cable.rogers.com.62719: Flags [P.], seq 4944:5140, ack 1, win 1573, length 196
00:57:03.824682 IP comp3134-Winter2023.ssh > cpee0dbd1ce3c00-cme0dbd1ce3bfe.cpe.net.cable.rogers.com.62719: Flags [P.], seq 5140:5176, ack 1, win 1573, length 36
00:57:03.824765 IP comp3134-Winter2023.ssh > cpee0dbd1ce3c00-cme0dbd1ce3bfe.cpe.net.cable.rogers.com.62719: Flags [P.], seq 5176:5372, ack 1, win 1573, length 196
00:57:03.824802 IP comp3134-Winter2023.ssh > cpee0dbd1ce3c00-cme0dbd1ce3bfe.cpe.net.cable.rogers.com.62719: Flags [P.], seq 5372:5408, ack 1, win 1573, length 36
00:57:03.824847 IP comp3134-Winter2023.ssh > cpee0dbd1ce3c00-cme0dbd1ce3bfe.cpe.net.cable.rogers.com.62719: Flags [P.], seq 5408:5604, ack 1, win 1573, length 196
00:57:03.824884 IP comp3134-Winter2023.ssh > cpee0dbd1ce3c00-cme0dbd1ce3bfe.cpe.net.cable.rogers.com.62719: Flags [P.], seq 5604:5640, ack 1, win 1573, length 36
00:57:03.824928 IP comp3134-Winter2023.ssh > cpee0dbd1ce3c00-cme0dbd1ce3bfe.cpe.net.cable.rogers.com.62719: Flags [P.], seq 5640:5836, ack 1, win 1573, length 196
00:57:03.834812 IP cpee0dbd1ce3c00-cme0dbd1ce3bfe.cpe.net.cable.rogers.com.62719 > comp3134-Winter2023.ssh: Flags [.], ack 5176, win 8280, length 0
00:57:03.834882 IP comp3134-Winter2023.ssh > cpee0dbd1ce3c00-cme0dbd1ce3bfe.cpe.net.cable.rogers.com.62719: Flags [P.], seq 5836:7496, ack 1, win 1573, length 1660
00:57:03.835046 IP comp3134-Winter2023.ssh > cpee0dbd1ce3c00-cme0dbd1ce3bfe.cpe.net.cable.rogers.com.62719: Flags [P.], seq 7496:7684, ack 1, win 1573, length 188
00:57:03.835111 IP comp3134-Winter2023.ssh > cpee0dbd1ce3c00-cme0dbd1ce3bfe.cpe.net.cable.rogers.com.62719: Flags [P.], seq 7684:7720, ack 1, win 1573, length 36
00:57:03.835163 IP comp3134-Winter2023.ssh > cpee0dbd1ce3c00-cme0dbd1ce3bfe.cpe.net.cable.rogers.com.62719: Flags [P.], seq 7720:7924, ack 1, win 1573, length 204
00:57:03.835199 IP comp3134-Winter2023.ssh > cpee0dbd1ce3c00-cme0dbd1ce3bfe.cpe.net.cable.rogers.com.62719: Flags [P.], seq 7924:7960, ack 1, win 1573, length 36
00:57:03.835243 IP comp3134-Winter2023.ssh > cpee0dbd1ce3c00-cme0dbd1ce3bfe.cpe.net.cable.rogers.com.62719: Flags [P.], seq 7960:8156, ack 1, win 1573, length 196
00:57:03.835276 IP comp3134-Winter2023.ssh > cpee0dbd1ce3c00-cme0dbd1ce3bfe.cpe.net.cable.rogers.com.62719: Flags [P.], seq 8156:8192, ack 1, win 1573, length 36
00:57:03.835318 IP comp3134-Winter2023.ssh > cpee0dbd1ce3c00-cme0dbd1ce3bfe.cpe.net.cable.rogers.com.62719: Flags [P.], seq 8192:8388, ack 1, win 1573, length 196
00:57:03.835351 IP comp3134-Winter2023.ssh > cpee0dbd1ce3c00-cme0dbd1ce3bfe.cpe.net.cable.rogers.com.62719: Flags [P.], seq 8388:8424, ack 1, win 1573, length 36
00:57:03.835392 IP comp3134-Winter2023.ssh > cpee0dbd1ce3c00-cme0dbd1ce3bfe.cpe.net.cable.rogers.com.62719: Flags [P.], seq 8424:8620, ack 1, win 1573, length 196
00:57:03.835425 IP comp3134-Winter2023.ssh > cpee0dbd1ce3c00-cme0dbd1ce3bfe.cpe.net.cable.rogers.com.62719: Flags [P.], seq 8620:8656, ack 1, win 1573, length 36
00:57:03.835466 IP comp3134-Winter2023.ssh > cpee0dbd1ce3c00-cme0dbd1ce3bfe.cpe.net.cable.rogers.com.62719: Flags [P.], seq 8656:8852, ack 1, win 1573, length 196
00:57:03.835528 IP comp3134-Winter2023.ssh > cpee0dbd1ce3c00-cme0dbd1ce3bfe.cpe.net.cable.rogers.com.62719: Flags [P.], seq 8852:9084, ack 1, win 1573, length 232
00:57:03.835583 IP comp3134-Winter2023.ssh > cpee0dbd1ce3c00-cme0dbd1ce3bfe.cpe.net.cable.rogers.com.62719: Flags [P.], seq 9084:9120, ack 1, win 1573, length 36
00:57:03.835612 IP comp3134-Winter2023.ssh > cpee0dbd1ce3c00-cme0dbd1ce3bfe.cpe.net.cable.rogers.com.62719: Flags [P.], seq 9120:9316, ack 1, win 1573, length 196
00:57:03.835649 IP comp3134-Winter2023.ssh > cpee0dbd1ce3c00-cme0dbd1ce3bfe.cpe.net.cable.rogers.com.62719: Flags [P.], seq 9316:9352, ack 1, win 1573, length 36
00:57:03.835690 IP comp3134-Winter2023.ssh > cpee0dbd1ce3c00-cme0dbd1ce3bfe.cpe.net.cable.rogers.com.62719: Flags [P.], seq 9352:9548, ack 1, win 1573, length 196
00:57:03.835725 IP comp3134-Winter2023.ssh > cpee0dbd1ce3c00-cme0dbd1ce3bfe.cpe.net.cable.rogers.com.62719: Flags [P.], seq 9548:9584, ack 1, win 1573, length 36
00:57:03.835771 IP comp3134-Winter2023.ssh > cpee0dbd1ce3c00-cme0dbd1ce3bfe.cpe.net.cable.rogers.com.62719: Flags [P.], seq 9584:9780, ack 1, win 1573, length 196
00:57:03.835806 IP comp3134-Winter2023.ssh > cpee0dbd1ce3c00-cme0dbd1ce3bfe.cpe.net.cable.rogers.com.62719: Flags [P.], seq 9780:9816, ack 1, win 1573, length 36
00:57:03.835848 IP comp3134-Winter2023.ssh > cpee0dbd1ce3c00-cme0dbd1ce3bfe.cpe.net.cable.rogers.com.62719: Flags [P.], seq 9816:10012, ack 1, win 1573, length 196
00:57:03.835883 IP comp3134-Winter2023.ssh > cpee0dbd1ce3c00-cme0dbd1ce3bfe.cpe.net.cable.rogers.com.62719: Flags [P.], seq 10012:10048, ack 1, win 1573, length 36
00:57:03.835923 IP comp3134-Winter2023.ssh > cpee0dbd1ce3c00-cme0dbd1ce3bfe.cpe.net.cable.rogers.com.62719: Flags [P.], seq 10048:10244, ack 1, win 1573, length 196
00:57:03.835962 IP comp3134-Winter2023.ssh > cpee0dbd1ce3c00-cme0dbd1ce3bfe.cpe.net.cable.rogers.com.62719: Flags [P.], seq 10244:10280, ack 1, win 1573, length 36
00:57:03.836001 IP comp3134-Winter2023.ssh > cpee0dbd1ce3c00-cme0dbd1ce3bfe.cpe.net.cable.rogers.com.62719: Flags [P.], seq 10280:10476, ack 1, win 1573, length 196
00:57:03.836036 IP comp3134-Winter2023.ssh > cpee0dbd1ce3c00-cme0dbd1ce3bfe.cpe.net.cable.rogers.com.62719: Flags [P.], seq 10476:10512, ack 1, win 1573, length 36
00:57:03.836090 IP comp3134-Winter2023.ssh > cpee0dbd1ce3c00-cme0dbd1ce3bfe.cpe.net.cable.rogers.com.62719: Flags [P.], seq 10512:10708, ack 1, win 1573, length 196
00:57:03.836126 IP comp3134-Winter2023.ssh > cpee0dbd1ce3c00-cme0dbd1ce3bfe.cpe.net.cable.rogers.com.62719: Flags [P.], seq 10708:10744, ack 1, win 1573, length 36
00:57:03.836294 IP comp3134-Winter2023.ssh > cpee0dbd1ce3c00-cme0dbd1ce3bfe.cpe.net.cable.rogers.com.62719: Flags [P.], seq 10744:10940, ack 1, win 1573, length 196
00:57:03.845602 IP cpee0dbd1ce3c00-cme0dbd1ce3bfe.cpe.net.cable.rogers.com.62719 > comp3134-Winter2023.ssh: Flags [.], ack 5836, win 8278, length 0
00:57:03.845672 IP comp3134-Winter2023.ssh > cpee0dbd1ce3c00-cme0dbd1ce3bfe.cpe.net.cable.rogers.com.62719: Flags [P.], seq 10940:13860, ack 1, win 1573, length 2920
00:57:03.845781 IP comp3134-Winter2023.ssh > cpee0dbd1ce3c00-cme0dbd1ce3bfe.cpe.net.cable.rogers.com.62719: Flags [P.], seq 13860:14528, ack 1, win 1573, length 668
00:57:03.845877 IP comp3134-Winter2023.ssh > cpee0dbd1ce3c00-cme0dbd1ce3bfe.cpe.net.cable.rogers.com.62719: Flags [P.], seq 14528:14716, ack 1, win 1573, length 188
00:57:03.845931 IP comp3134-Winter2023.ssh > cpee0dbd1ce3c00-cme0dbd1ce3bfe.cpe.net.cable.rogers.com.62719: Flags [P.], seq 14716:14752, ack 1, win 1573, length 36
00:57:03.845983 IP comp3134-Winter2023.ssh > cpee0dbd1ce3c00-cme0dbd1ce3bfe.cpe.net.cable.rogers.com.62719: Flags [P.], seq 14752:14956, ack 1, win 1573, length 204
00:57:03.846097 IP comp3134-Winter2023.ssh > cpee0dbd1ce3c00-cme0dbd1ce3bfe.cpe.net.cable.rogers.com.62719: Flags [P.], seq 14956:14992, ack 1, win 1573, length 36
00:57:03.846147 IP comp3134-Winter2023.ssh > cpee0dbd1ce3c00-cme0dbd1ce3bfe.cpe.net.cable.rogers.com.62719: Flags [P.], seq 14992:15196, ack 1, win 1573, length 204
00:57:03.846185 IP comp3134-Winter2023.ssh > cpee0dbd1ce3c00-cme0dbd1ce3bfe.cpe.net.cable.rogers.com.62719: Flags [P.], seq 15196:15232, ack 1, win 1573, length 36
00:57:03.846231 IP comp3134-Winter2023.ssh > cpee0dbd1ce3c00-cme0dbd1ce3bfe.cpe.net.cable.rogers.com.62719: Flags [P.], seq 15232:15436, ack 1, win 1573, length 204
00:57:03.856391 IP cpee0dbd1ce3c00-cme0dbd1ce3bfe.cpe.net.cable.rogers.com.62719 > comp3134-Winter2023.ssh: Flags [.], ack 10940, win 8275, length 0
00:57:03.856475 IP comp3134-Winter2023.ssh > cpee0dbd1ce3c00-cme0dbd1ce3bfe.cpe.net.cable.rogers.com.62719: Flags [P.], seq 15436:16912, ack 1, win 1573, length 1476
00:57:03.856658 IP comp3134-Winter2023.ssh > cpee0dbd1ce3c00-cme0dbd1ce3bfe.cpe.net.cable.rogers.com.62719: Flags [P.], seq 16912:17100, ack 1, win 1573, length 188
00:57:03.856732 IP comp3134-Winter2023.ssh > cpee0dbd1ce3c00-cme0dbd1ce3bfe.cpe.net.cable.rogers.com.62719: Flags [P.], seq 17100:17136, ack 1, win 1573, length 36
00:57:03.856788 IP comp3134-Winter2023.ssh > cpee0dbd1ce3c00-cme0dbd1ce3bfe.cpe.net.cable.rogers.com.62719: Flags [P.], seq 17136:17340, ack 1, win 1573, length 204
00:57:03.856828 IP comp3134-Winter2023.ssh > cpee0dbd1ce3c00-cme0dbd1ce3bfe.cpe.net.cable.rogers.com.62719: Flags [P.], seq 17340:17376, ack 1, win 1573, length 36
00:57:03.856877 IP comp3134-Winter2023.ssh > cpee0dbd1ce3c00-cme0dbd1ce3bfe.cpe.net.cable.rogers.com.62719: Flags [P.], seq 17376:17580, ack 1, win 1573, length 204
00:57:03.856913 IP comp3134-Winter2023.ssh > cpee0dbd1ce3c00-cme0dbd1ce3bfe.cpe.net.cable.rogers.com.62719: Flags [P.], seq 17580:17616, ack 1, win 1573, length 36
00:57:03.856958 IP comp3134-Winter2023.ssh > cpee0dbd1ce3c00-cme0dbd1ce3bfe.cpe.net.cable.rogers.com.62719: Flags [P.], seq 17616:17820, ack 1, win 1573, length 204
00:57:03.856995 IP comp3134-Winter2023.ssh > cpee0dbd1ce3c00-cme0dbd1ce3bfe.cpe.net.cable.rogers.com.62719: Flags [P.], seq 17820:17856, ack 1, win 1573, length 36
00:57:03.857042 IP comp3134-Winter2023.ssh > cpee0dbd1ce3c00-cme0dbd1ce3bfe.cpe.net.cable.rogers.com.62719: Flags [P.], seq 17856:18060, ack 1, win 1573, length 204
00:57:03.857078 IP comp3134-Winter2023.ssh > cpee0dbd1ce3c00-cme0dbd1ce3bfe.cpe.net.cable.rogers.com.62719: Flags [P.], seq 18060:18096, ack 1, win 1573, length 36
00:57:03.857124 IP comp3134-Winter2023.ssh > cpee0dbd1ce3c00-cme0dbd1ce3bfe.cpe.net.cable.rogers.com.62719: Flags [P.], seq 18096:18300, ack 1, win 1573, length 204
00:57:03.857159 IP comp3134-Winter2023.ssh > cpee0dbd1ce3c00-cme0dbd1ce3bfe.cpe.net.cable.rogers.com.62719: Flags [P.], seq 18300:18336, ack 1, win 1573, length 36
00:57:03.857203 IP comp3134-Winter2023.ssh > cpee0dbd1ce3c00-cme0dbd1ce3bfe.cpe.net.cable.rogers.com.62719: Flags [P.], seq 18336:18540, ack 1, win 1573, length 204
00:57:03.857242 IP comp3134-Winter2023.ssh > cpee0dbd1ce3c00-cme0dbd1ce3bfe.cpe.net.cable.rogers.com.62719: Flags [P.], seq 18540:18576, ack 1, win 1573, length 36
00:57:03.857286 IP comp3134-Winter2023.ssh > cpee0dbd1ce3c00-cme0dbd1ce3bfe.cpe.net.cable.rogers.com.62719: Flags [P.], seq 18576:18780, ack 1, win 1573, length 204
00:57:03.857325 IP comp3134-Winter2023.ssh > cpee0dbd1ce3c00-cme0dbd1ce3bfe.cpe.net.cable.rogers.com.62719: Flags [P.], seq 18780:18816, ack 1, win 1573, length 36
00:57:03.857370 IP comp3134-Winter2023.ssh > cpee0dbd1ce3c00-cme0dbd1ce3bfe.cpe.net.cable.rogers.com.62719: Flags [P.], seq 18816:19020, ack 1, win 1573, length 204
00:57:03.857407 IP comp3134-Winter2023.ssh > cpee0dbd1ce3c00-cme0dbd1ce3bfe.cpe.net.cable.rogers.com.62719: Flags [P.], seq 19020:19056, ack 1, win 1573, length 36
00:57:03.857449 IP comp3134-Winter2023.ssh > cpee0dbd1ce3c00-cme0dbd1ce3bfe.cpe.net.cable.rogers.com.62719: Flags [P.], seq 19056:19260, ack 1, win 1573, length 204
00:57:03.857486 IP comp3134-Winter2023.ssh > cpee0dbd1ce3c00-cme0dbd1ce3bfe.cpe.net.cable.rogers.com.62719: Flags [P.], seq 19260:19296, ack 1, win 1573, length 36
00:57:03.857529 IP comp3134-Winter2023.ssh > cpee0dbd1ce3c00-cme0dbd1ce3bfe.cpe.net.cable.rogers.com.62719: Flags [P.], seq 19296:19500, ack 1, win 1573, length 204
00:57:03.857594 IP comp3134-Winter2023.ssh > cpee0dbd1ce3c00-cme0dbd1ce3bfe.cpe.net.cable.rogers.com.62719: Flags [P.], seq 19500:19740, ack 1, win 1573, length 240
00:57:03.857938 IP comp3134-Winter2023.ssh > cpee0dbd1ce3c00-cme0dbd1ce3bfe.cpe.net.cable.rogers.com.62719: Flags [P.], seq 19740:21420, ack 1, win 1573, length 1680
00:57:03.857984 IP comp3134-Winter2023.ssh > cpee0dbd1ce3c00-cme0dbd1ce3bfe.cpe.net.cable.rogers.com.62719: Flags [P.], seq 21420:21456, ack 1, win 1573, length 36
00:57:03.858024 IP comp3134-Winter2023.ssh > cpee0dbd1ce3c00-cme0dbd1ce3bfe.cpe.net.cable.rogers.com.62719: Flags [P.], seq 21456:21660, ack 1, win 1573, length 204
00:57:03.858059 IP comp3134-Winter2023.ssh > cpee0dbd1ce3c00-cme0dbd1ce3bfe.cpe.net.cable.rogers.com.62719: Flags [P.], seq 21660:21696, ack 1, win 1573, length 36
00:57:03.858101 IP comp3134-Winter2023.ssh > cpee0dbd1ce3c00-cme0dbd1ce3bfe.cpe.net.cable.rogers.com.62719: Flags [P.], seq 21696:21900, ack 1, win 1573, length 204
00:57:03.858146 IP comp3134-Winter2023.ssh > cpee0dbd1ce3c00-cme0dbd1ce3bfe.cpe.net.cable.rogers.com.62719: Flags [P.], seq 21900:21936, ack 1, win 1573, length 36
00:57:03.858190 IP comp3134-Winter2023.ssh > cpee0dbd1ce3c00-cme0dbd1ce3bfe.cpe.net.cable.rogers.com.62719: Flags [P.], seq 21936:22140, ack 1, win 1573, length 204
00:57:03.858228 IP comp3134-Winter2023.ssh > cpee0dbd1ce3c00-cme0dbd1ce3bfe.cpe.net.cable.rogers.com.62719: Flags [P.], seq 22140:22176, ack 1, win 1573, length 36
00:57:03.858283 IP comp3134-Winter2023.ssh > cpee0dbd1ce3c00-cme0dbd1ce3bfe.cpe.net.cable.rogers.com.62719: Flags [P.], seq 22176:22380, ack 1, win 1573, length 204
00:57:03.858498 IP comp3134-Winter2023.ssh > cpee0dbd1ce3c00-cme0dbd1ce3bfe.cpe.net.cable.rogers.com.62719: Flags [P.], seq 22380:23376, ack 1, win 1573, length 996
00:57:03.858537 IP comp3134-Winter2023.ssh > cpee0dbd1ce3c00-cme0dbd1ce3bfe.cpe.net.cable.rogers.com.62719: Flags [P.], seq 23376:23580, ack 1, win 1573, length 204
00:57:03.858572 IP comp3134-Winter2023.ssh > cpee0dbd1ce3c00-cme0dbd1ce3bfe.cpe.net.cable.rogers.com.62719: Flags [P.], seq 23580:23616, ack 1, win 1573, length 36
00:57:03.858614 IP comp3134-Winter2023.ssh > cpee0dbd1ce3c00-cme0dbd1ce3bfe.cpe.net.cable.rogers.com.62719: Flags [P.], seq 23616:23820, ack 1, win 1573, length 204
00:57:03.858651 IP comp3134-Winter2023.ssh > cpee0dbd1ce3c00-cme0dbd1ce3bfe.cpe.net.cable.rogers.com.62719: Flags [P.], seq 23820:23856, ack 1, win 1573, length 36
00:57:03.858693 IP comp3134-Winter2023.ssh > cpee0dbd1ce3c00-cme0dbd1ce3bfe.cpe.net.cable.rogers.com.62719: Flags [P.], seq 23856:24060, ack 1, win 1573, length 204
00:57:03.858729 IP comp3134-Winter2023.ssh > cpee0dbd1ce3c00-cme0dbd1ce3bfe.cpe.net.cable.rogers.com.62719: Flags [P.], seq 24060:24096, ack 1, win 1573, length 36
00:57:03.858802 IP comp3134-Winter2023.ssh > cpee0dbd1ce3c00-cme0dbd1ce3bfe.cpe.net.cable.rogers.com.62719: Flags [P.], seq 24096:24628, ack 1, win 1573, length 532
00:57:03.858899 IP comp3134-Winter2023.ssh > cpee0dbd1ce3c00-cme0dbd1ce3bfe.cpe.net.cable.rogers.com.62719: Flags [P.], seq 24628:25496, ack 1, win 1573, length 868
00:57:03.858986 IP comp3134-Winter2023.ssh > cpee0dbd1ce3c00-cme0dbd1ce3bfe.cpe.net.cable.rogers.com.62719: Flags [P.], seq 25496:26196, ack 1, win 1573, length 700
00:57:03.859048 IP comp3134-Winter2023.ssh > cpee0dbd1ce3c00-cme0dbd1ce3bfe.cpe.net.cable.rogers.com.62719: Flags [P.], seq 26196:26400, ack 1, win 1573, length 204
00:57:03.859104 IP comp3134-Winter2023.ssh > cpee0dbd1ce3c00-cme0dbd1ce3bfe.cpe.net.cable.rogers.com.62719: Flags [P.], seq 26400:26604, ack 1, win 1573, length 204
00:57:03.859176 IP comp3134-Winter2023.ssh > cpee0dbd1ce3c00-cme0dbd1ce3bfe.cpe.net.cable.rogers.com.62719: Flags [P.], seq 26604:26808, ack 1, win 1573, length 204
00:57:03.859233 IP comp3134-Winter2023.ssh > cpee0dbd1ce3c00-cme0dbd1ce3bfe.cpe.net.cable.rogers.com.62719: Flags [P.], seq 26808:27012, ack 1, win 1573, length 204
00:57:03.859285 IP comp3134-Winter2023.ssh > cpee0dbd1ce3c00-cme0dbd1ce3bfe.cpe.net.cable.rogers.com.62719: Flags [P.], seq 27012:27216, ack 1, win 1573, length 204
00:57:03.859336 IP comp3134-Winter2023.ssh > cpee0dbd1ce3c00-cme0dbd1ce3bfe.cpe.net.cable.rogers.com.62719: Flags [P.], seq 27216:27420, ack 1, win 1573, length 204
00:57:03.859386 IP comp3134-Winter2023.ssh > cpee0dbd1ce3c00-cme0dbd1ce3bfe.cpe.net.cable.rogers.com.62719: Flags [P.], seq 27420:27624, ack 1, win 1573, length 204
00:57:03.859437 IP comp3134-Winter2023.ssh > cpee0dbd1ce3c00-cme0dbd1ce3bfe.cpe.net.cable.rogers.com.62719: Flags [P.], seq 27624:27828, ack 1, win 1573, length 204
00:57:03.859488 IP comp3134-Winter2023.ssh > cpee0dbd1ce3c00-cme0dbd1ce3bfe.cpe.net.cable.rogers.com.62719: Flags [P.], seq 27828:28032, ack 1, win 1573, length 204
00:57:03.859539 IP comp3134-Winter2023.ssh > cpee0dbd1ce3c00-cme0dbd1ce3bfe.cpe.net.cable.rogers.com.62719: Flags [P.], seq 28032:28236, ack 1, win 1573, length 204
00:57:03.859589 IP comp3134-Winter2023.ssh > cpee0dbd1ce3c00-cme0dbd1ce3bfe.cpe.net.cable.rogers.com.62719: Flags [P.], seq 28236:28440, ack 1, win 1573, length 204
00:57:03.859640 IP comp3134-Winter2023.ssh > cpee0dbd1ce3c00-cme0dbd1ce3bfe.cpe.net.cable.rogers.com.62719: Flags [P.], seq 28440:28644, ack 1, win 1573, length 204
00:57:03.859693 IP comp3134-Winter2023.ssh > cpee0dbd1ce3c00-cme0dbd1ce3bfe.cpe.net.cable.rogers.com.62719: Flags [P.], seq 28644:28848, ack 1, win 1573, length 204
00:57:03.859744 IP comp3134-Winter2023.ssh > cpee0dbd1ce3c00-cme0dbd1ce3bfe.cpe.net.cable.rogers.com.62719: Flags [P.], seq 28848:29052, ack 1, win 1573, length 204
00:57:03.859795 IP comp3134-Winter2023.ssh > cpee0dbd1ce3c00-cme0dbd1ce3bfe.cpe.net.cable.rogers.com.62719: Flags [P.], seq 29052:29256, ack 1, win 1573, length 204
00:57:03.859845 IP comp3134-Winter2023.ssh > cpee0dbd1ce3c00-cme0dbd1ce3bfe.cpe.net.cable.rogers.com.62719: Flags [P.], seq 29256:29460, ack 1, win 1573, length 204
00:57:03.867242 IP cpee0dbd1ce3c00-cme0dbd1ce3bfe.cpe.net.cable.rogers.com.62719 > comp3134-Winter2023.ssh: Flags [.], ack 16912, win 8280, length 0
00:57:03.867317 IP comp3134-Winter2023.ssh > cpee0dbd1ce3c00-cme0dbd1ce3bfe.cpe.net.cable.rogers.com.62719: Flags [P.], seq 29460:29664, ack 1, win 1573, length 204
00:57:03.867536 IP comp3134-Winter2023.ssh > cpee0dbd1ce3c00-cme0dbd1ce3bfe.cpe.net.cable.rogers.com.62719: Flags [P.], seq 29664:30020, ack 1, win 1573, length 356
00:57:03.867639 IP comp3134-Winter2023.ssh > cpee0dbd1ce3c00-cme0dbd1ce3bfe.cpe.net.cable.rogers.com.62719: Flags [P.], seq 30020:30224, ack 1, win 1573, length 204
00:57:03.867697 IP comp3134-Winter2023.ssh > cpee0dbd1ce3c00-cme0dbd1ce3bfe.cpe.net.cable.rogers.com.62719: Flags [P.], seq 30224:30428, ack 1, win 1573, length 204
00:57:03.867754 IP comp3134-Winter2023.ssh > cpee0dbd1ce3c00-cme0dbd1ce3bfe.cpe.net.cable.rogers.com.62719: Flags [P.], seq 30428:30632, ack 1, win 1573, length 204
00:57:03.867808 IP comp3134-Winter2023.ssh > cpee0dbd1ce3c00-cme0dbd1ce3bfe.cpe.net.cable.rogers.com.62719: Flags [P.], seq 30632:30836, ack 1, win 1573, length 204
00:57:03.867861 IP comp3134-Winter2023.ssh > cpee0dbd1ce3c00-cme0dbd1ce3bfe.cpe.net.cable.rogers.com.62719: Flags [P.], seq 30836:31040, ack 1, win 1573, length 204
00:57:03.867916 IP comp3134-Winter2023.ssh > cpee0dbd1ce3c00-cme0dbd1ce3bfe.cpe.net.cable.rogers.com.62719: Flags [P.], seq 31040:31244, ack 1, win 1573, length 204
00:57:03.867971 IP comp3134-Winter2023.ssh > cpee0dbd1ce3c00-cme0dbd1ce3bfe.cpe.net.cable.rogers.com.62719: Flags [P.], seq 31244:31448, ack 1, win 1573, length 204
00:57:03.868026 IP comp3134-Winter2023.ssh > cpee0dbd1ce3c00-cme0dbd1ce3bfe.cpe.net.cable.rogers.com.62719: Flags [P.], seq 31448:31652, ack 1, win 1573, length 204
00:57:03.868080 IP comp3134-Winter2023.ssh > cpee0dbd1ce3c00-cme0dbd1ce3bfe.cpe.net.cable.rogers.com.62719: Flags [P.], seq 31652:31856, ack 1, win 1573, length 204
00:57:03.868135 IP comp3134-Winter2023.ssh > cpee0dbd1ce3c00-cme0dbd1ce3bfe.cpe.net.cable.rogers.com.62719: Flags [P.], seq 31856:32060, ack 1, win 1573, length 204
00:57:03.868350 IP comp3134-Winter2023.ssh > cpee0dbd1ce3c00-cme0dbd1ce3bfe.cpe.net.cable.rogers.com.62719: Flags [P.], seq 32060:32264, ack 1, win 1573, length 204
00:57:03.868412 IP comp3134-Winter2023.ssh > cpee0dbd1ce3c00-cme0dbd1ce3bfe.cpe.net.cable.rogers.com.62719: Flags [P.], seq 32264:32468, ack 1, win 1573, length 204
00:57:03.868470 IP comp3134-Winter2023.ssh > cpee0dbd1ce3c00-cme0dbd1ce3bfe.cpe.net.cable.rogers.com.62719: Flags [P.], seq 32468:32672, ack 1, win 1573, length 204
00:57:03.868534 IP comp3134-Winter2023.ssh > cpee0dbd1ce3c00-cme0dbd1ce3bfe.cpe.net.cable.rogers.com.62719: Flags [P.], seq 32672:32876, ack 1, win 1573, length 204
00:57:03.868610 IP comp3134-Winter2023.ssh > cpee0dbd1ce3c00-cme0dbd1ce3bfe.cpe.net.cable.rogers.com.62719: Flags [P.], seq 32876:33080, ack 1, win 1573, length 204
00:57:03.868670 IP comp3134-Winter2023.ssh > cpee0dbd1ce3c00-cme0dbd1ce3bfe.cpe.net.cable.rogers.com.62719: Flags [P.], seq 33080:33284, ack 1, win 1573, length 204
00:57:03.868753 IP comp3134-Winter2023.ssh > cpee0dbd1ce3c00-cme0dbd1ce3bfe.cpe.net.cable.rogers.com.62719: Flags [P.], seq 33284:33488, ack 1, win 1573, length 204
00:57:03.868812 IP comp3134-Winter2023.ssh > cpee0dbd1ce3c00-cme0dbd1ce3bfe.cpe.net.cable.rogers.com.62719: Flags [P.], seq 33488:33692, ack 1, win 1573, length 204
00:57:03.868871 IP comp3134-Winter2023.ssh > cpee0dbd1ce3c00-cme0dbd1ce3bfe.cpe.net.cable.rogers.com.62719: Flags [P.], seq 33692:33896, ack 1, win 1573, length 204
00:57:03.868930 IP comp3134-Winter2023.ssh > cpee0dbd1ce3c00-cme0dbd1ce3bfe.cpe.net.cable.rogers.com.62719: Flags [P.], seq 33896:34100, ack 1, win 1573, length 204
00:57:03.868988 IP comp3134-Winter2023.ssh > cpee0dbd1ce3c00-cme0dbd1ce3bfe.cpe.net.cable.rogers.com.62719: Flags [P.], seq 34100:34304, ack 1, win 1573, length 204
00:57:03.869047 IP comp3134-Winter2023.ssh > cpee0dbd1ce3c00-cme0dbd1ce3bfe.cpe.net.cable.rogers.com.62719: Flags [P.], seq 34304:34508, ack 1, win 1573, length 204
00:57:03.878008 IP cpee0dbd1ce3c00-cme0dbd1ce3bfe.cpe.net.cable.rogers.com.62719 > comp3134-Winter2023.ssh: Flags [.], ack 29460, win 8280, length 0
00:57:03.878110 IP comp3134-Winter2023.ssh > cpee0dbd1ce3c00-cme0dbd1ce3bfe.cpe.net.cable.rogers.com.62719: Flags [P.], seq 34508:34712, ack 1, win 1573, length 204
00:57:03.878318 IP comp3134-Winter2023.ssh > cpee0dbd1ce3c00-cme0dbd1ce3bfe.cpe.net.cable.rogers.com.62719: Flags [P.], seq 34712:35068, ack 1, win 1573, length 356
00:57:03.878395 IP comp3134-Winter2023.ssh > cpee0dbd1ce3c00-cme0dbd1ce3bfe.cpe.net.cable.rogers.com.62719: Flags [P.], seq 35068:35272, ack 1, win 1573, length 204
00:57:03.878453 IP comp3134-Winter2023.ssh > cpee0dbd1ce3c00-cme0dbd1ce3bfe.cpe.net.cable.rogers.com.62719: Flags [P.], seq 35272:35476, ack 1, win 1573, length 204
00:57:03.878508 IP comp3134-Winter2023.ssh > cpee0dbd1ce3c00-cme0dbd1ce3bfe.cpe.net.cable.rogers.com.62719: Flags [P.], seq 35476:35680, ack 1, win 1573, length 204
00:57:03.878563 IP comp3134-Winter2023.ssh > cpee0dbd1ce3c00-cme0dbd1ce3bfe.cpe.net.cable.rogers.com.62719: Flags [P.], seq 35680:35884, ack 1, win 1573, length 204
00:57:03.878640 IP comp3134-Winter2023.ssh > cpee0dbd1ce3c00-cme0dbd1ce3bfe.cpe.net.cable.rogers.com.62719: Flags [P.], seq 35884:36088, ack 1, win 1573, length 204
00:57:03.878700 IP comp3134-Winter2023.ssh > cpee0dbd1ce3c00-cme0dbd1ce3bfe.cpe.net.cable.rogers.com.62719: Flags [P.], seq 36088:36292, ack 1, win 1573, length 204
00:57:03.878766 IP comp3134-Winter2023.ssh > cpee0dbd1ce3c00-cme0dbd1ce3bfe.cpe.net.cable.rogers.com.62719: Flags [P.], seq 36292:36496, ack 1, win 1573, length 204
00:57:03.878824 IP comp3134-Winter2023.ssh > cpee0dbd1ce3c00-cme0dbd1ce3bfe.cpe.net.cable.rogers.com.62719: Flags [P.], seq 36496:36700, ack 1, win 1573, length 204
00:57:03.878883 IP comp3134-Winter2023.ssh > cpee0dbd1ce3c00-cme0dbd1ce3bfe.cpe.net.cable.rogers.com.62719: Flags [P.], seq 36700:36904, ack 1, win 1573, length 204
00:57:03.878940 IP comp3134-Winter2023.ssh > cpee0dbd1ce3c00-cme0dbd1ce3bfe.cpe.net.cable.rogers.com.62719: Flags [P.], seq 36904:37108, ack 1, win 1573, length 204
00:57:03.878993 IP comp3134-Winter2023.ssh > cpee0dbd1ce3c00-cme0dbd1ce3bfe.cpe.net.cable.rogers.com.62719: Flags [P.], seq 37108:37312, ack 1, win 1573, length 204
00:57:03.879047 IP comp3134-Winter2023.ssh > cpee0dbd1ce3c00-cme0dbd1ce3bfe.cpe.net.cable.rogers.com.62719: Flags [P.], seq 37312:37516, ack 1, win 1573, length 204
00:57:03.879102 IP comp3134-Winter2023.ssh > cpee0dbd1ce3c00-cme0dbd1ce3bfe.cpe.net.cable.rogers.com.62719: Flags [P.], seq 37516:37720, ack 1, win 1573, length 204
00:57:03.879159 IP comp3134-Winter2023.ssh > cpee0dbd1ce3c00-cme0dbd1ce3bfe.cpe.net.cable.rogers.com.62719: Flags [P.], seq 37720:37924, ack 1, win 1573, length 204
00:57:03.879217 IP comp3134-Winter2023.ssh > cpee0dbd1ce3c00-cme0dbd1ce3bfe.cpe.net.cable.rogers.com.62719: Flags [P.], seq 37924:38128, ack 1, win 1573, length 204
00:57:03.879275 IP comp3134-Winter2023.ssh > cpee0dbd1ce3c00-cme0dbd1ce3bfe.cpe.net.cable.rogers.com.62719: Flags [P.], seq 38128:38332, ack 1, win 1573, length 204
00:57:03.879333 IP comp3134-Winter2023.ssh > cpee0dbd1ce3c00-cme0dbd1ce3bfe.cpe.net.cable.rogers.com.62719: Flags [P.], seq 38332:38536, ack 1, win 1573, length 204
00:57:03.879393 IP comp3134-Winter2023.ssh > cpee0dbd1ce3c00-cme0dbd1ce3bfe.cpe.net.cable.rogers.com.62719: Flags [P.], seq 38536:38740, ack 1, win 1573, length 204
00:57:03.879450 IP comp3134-Winter2023.ssh > cpee0dbd1ce3c00-cme0dbd1ce3bfe.cpe.net.cable.rogers.com.62719: Flags [P.], seq 38740:38944, ack 1, win 1573, length 204
00:57:03.879504 IP comp3134-Winter2023.ssh > cpee0dbd1ce3c00-cme0dbd1ce3bfe.cpe.net.cable.rogers.com.62719: Flags [P.], seq 38944:39148, ack 1, win 1573, length 204
00:57:03.879560 IP comp3134-Winter2023.ssh > cpee0dbd1ce3c00-cme0dbd1ce3bfe.cpe.net.cable.rogers.com.62719: Flags [P.], seq 39148:39352, ack 1, win 1573, length 204
00:57:03.879613 IP comp3134-Winter2023.ssh > cpee0dbd1ce3c00-cme0dbd1ce3bfe.cpe.net.cable.rogers.com.62719: Flags [P.], seq 39352:39556, ack 1, win 1573, length 204
00:57:03.879667 IP comp3134-Winter2023.ssh > cpee0dbd1ce3c00-cme0dbd1ce3bfe.cpe.net.cable.rogers.com.62719: Flags [P.], seq 39556:39760, ack 1, win 1573, length 204
00:57:03.879722 IP comp3134-Winter2023.ssh > cpee0dbd1ce3c00-cme0dbd1ce3bfe.cpe.net.cable.rogers.com.62719: Flags [P.], seq 39760:39964, ack 1, win 1573, length 204
00:57:03.879778 IP comp3134-Winter2023.ssh > cpee0dbd1ce3c00-cme0dbd1ce3bfe.cpe.net.cable.rogers.com.62719: Flags [P.], seq 39964:40168, ack 1, win 1573, length 204
00:57:03.879852 IP comp3134-Winter2023.ssh > cpee0dbd1ce3c00-cme0dbd1ce3bfe.cpe.net.cable.rogers.com.62719: Flags [P.], seq 40168:40372, ack 1, win 1573, length 204
00:57:03.879919 IP comp3134-Winter2023.ssh > cpee0dbd1ce3c00-cme0dbd1ce3bfe.cpe.net.cable.rogers.com.62719: Flags [P.], seq 40372:40576, ack 1, win 1573, length 204
00:57:03.879978 IP comp3134-Winter2023.ssh > cpee0dbd1ce3c00-cme0dbd1ce3bfe.cpe.net.cable.rogers.com.62719: Flags [P.], seq 40576:40780, ack 1, win 1573, length 204
00:57:03.880038 IP comp3134-Winter2023.ssh > cpee0dbd1ce3c00-cme0dbd1ce3bfe.cpe.net.cable.rogers.com.62719: Flags [P.], seq 40780:40984, ack 1, win 1573, length 204
00:57:03.880094 IP comp3134-Winter2023.ssh > cpee0dbd1ce3c00-cme0dbd1ce3bfe.cpe.net.cable.rogers.com.62719: Flags [P.], seq 40984:41188, ack 1, win 1573, length 204
00:57:03.880331 IP comp3134-Winter2023.ssh > cpee0dbd1ce3c00-cme0dbd1ce3bfe.cpe.net.cable.rogers.com.62719: Flags [P.], seq 41188:41392, ack 1, win 1573, length 204
00:57:03.880436 IP comp3134-Winter2023.ssh > cpee0dbd1ce3c00-cme0dbd1ce3bfe.cpe.net.cable.rogers.com.62719: Flags [P.], seq 41392:41596, ack 1, win 1573, length 204
00:57:03.880498 IP comp3134-Winter2023.ssh > cpee0dbd1ce3c00-cme0dbd1ce3bfe.cpe.net.cable.rogers.com.62719: Flags [P.], seq 41596:41800, ack 1, win 1573, length 204
00:57:03.880555 IP comp3134-Winter2023.ssh > cpee0dbd1ce3c00-cme0dbd1ce3bfe.cpe.net.cable.rogers.com.62719: Flags [P.], seq 41800:42004, ack 1, win 1573, length 204
00:57:03.880612 IP comp3134-Winter2023.ssh > cpee0dbd1ce3c00-cme0dbd1ce3bfe.cpe.net.cable.rogers.com.62719: Flags [P.], seq 42004:42208, ack 1, win 1573, length 204
00:57:03.880676 IP comp3134-Winter2023.ssh > cpee0dbd1ce3c00-cme0dbd1ce3bfe.cpe.net.cable.rogers.com.62719: Flags [P.], seq 42208:42412, ack 1, win 1573, length 204
00:57:03.880758 IP comp3134-Winter2023.ssh > cpee0dbd1ce3c00-cme0dbd1ce3bfe.cpe.net.cable.rogers.com.62719: Flags [P.], seq 42412:42616, ack 1, win 1573, length 204
00:57:03.880813 IP comp3134-Winter2023.ssh > cpee0dbd1ce3c00-cme0dbd1ce3bfe.cpe.net.cable.rogers.com.62719: Flags [P.], seq 42616:42820, ack 1, win 1573, length 204
00:57:03.880865 IP comp3134-Winter2023.ssh > cpee0dbd1ce3c00-cme0dbd1ce3bfe.cpe.net.cable.rogers.com.62719: Flags [P.], seq 42820:43024, ack 1, win 1573, length 204
00:57:03.880917 IP comp3134-Winter2023.ssh > cpee0dbd1ce3c00-cme0dbd1ce3bfe.cpe.net.cable.rogers.com.62719: Flags [P.], seq 43024:43228, ack 1, win 1573, length 204
00:57:03.880968 IP comp3134-Winter2023.ssh > cpee0dbd1ce3c00-cme0dbd1ce3bfe.cpe.net.cable.rogers.com.62719: Flags [P.], seq 43228:43432, ack 1, win 1573, length 204
00:57:03.881020 IP comp3134-Winter2023.ssh > cpee0dbd1ce3c00-cme0dbd1ce3bfe.cpe.net.cable.rogers.com.62719: Flags [P.], seq 43432:43636, ack 1, win 1573, length 204
00:57:03.881074 IP comp3134-Winter2023.ssh > cpee0dbd1ce3c00-cme0dbd1ce3bfe.cpe.net.cable.rogers.com.62719: Flags [P.], seq 43636:43840, ack 1, win 1573, length 204
00:57:03.881129 IP comp3134-Winter2023.ssh > cpee0dbd1ce3c00-cme0dbd1ce3bfe.cpe.net.cable.rogers.com.62719: Flags [P.], seq 43840:44044, ack 1, win 1573, length 204
00:57:03.881214 IP comp3134-Winter2023.ssh > cpee0dbd1ce3c00-cme0dbd1ce3bfe.cpe.net.cable.rogers.com.62719: Flags [P.], seq 44044:44248, ack 1, win 1573, length 204
00:57:03.881272 IP comp3134-Winter2023.ssh > cpee0dbd1ce3c00-cme0dbd1ce3bfe.cpe.net.cable.rogers.com.62719: Flags [P.], seq 44248:44452, ack 1, win 1573, length 204
00:57:03.881327 IP comp3134-Winter2023.ssh > cpee0dbd1ce3c00-cme0dbd1ce3bfe.cpe.net.cable.rogers.com.62719: Flags [P.], seq 44452:44656, ack 1, win 1573, length 204
00:57:03.881382 IP comp3134-Winter2023.ssh > cpee0dbd1ce3c00-cme0dbd1ce3bfe.cpe.net.cable.rogers.com.62719: Flags [P.], seq 44656:44860, ack 1, win 1573, length 204
00:57:03.881435 IP comp3134-Winter2023.ssh > cpee0dbd1ce3c00-cme0dbd1ce3bfe.cpe.net.cable.rogers.com.62719: Flags [P.], seq 44860:45064, ack 1, win 1573, length 204
00:57:03.881487 IP comp3134-Winter2023.ssh > cpee0dbd1ce3c00-cme0dbd1ce3bfe.cpe.net.cable.rogers.com.62719: Flags [P.], seq 45064:45268, ack 1, win 1573, length 204
00:57:03.881538 IP comp3134-Winter2023.ssh > cpee0dbd1ce3c00-cme0dbd1ce3bfe.cpe.net.cable.rogers.com.62719: Flags [P.], seq 45268:45472, ack 1, win 1573, length 204
00:57:03.881591 IP comp3134-Winter2023.ssh > cpee0dbd1ce3c00-cme0dbd1ce3bfe.cpe.net.cable.rogers.com.62719: Flags [P.], seq 45472:45676, ack 1, win 1573, length 204
00:57:03.881647 IP comp3134-Winter2023.ssh > cpee0dbd1ce3c00-cme0dbd1ce3bfe.cpe.net.cable.rogers.com.62719: Flags [P.], seq 45676:45880, ack 1, win 1573, length 204
00:57:03.881697 IP comp3134-Winter2023.ssh > cpee0dbd1ce3c00-cme0dbd1ce3bfe.cpe.net.cable.rogers.com.62719: Flags [P.], seq 45880:46084, ack 1, win 1573, length 204
00:57:03.881750 IP comp3134-Winter2023.ssh > cpee0dbd1ce3c00-cme0dbd1ce3bfe.cpe.net.cable.rogers.com.62719: Flags [P.], seq 46084:46288, ack 1, win 1573, length 204
00:57:03.881804 IP comp3134-Winter2023.ssh > cpee0dbd1ce3c00-cme0dbd1ce3bfe.cpe.net.cable.rogers.com.62719: Flags [P.], seq 46288:46492, ack 1, win 1573, length 204
00:57:03.881854 IP comp3134-Winter2023.ssh > cpee0dbd1ce3c00-cme0dbd1ce3bfe.cpe.net.cable.rogers.com.62719: Flags [P.], seq 46492:46696, ack 1, win 1573, length 204
00:57:03.881903 IP comp3134-Winter2023.ssh > cpee0dbd1ce3c00-cme0dbd1ce3bfe.cpe.net.cable.rogers.com.62719: Flags [P.], seq 46696:46900, ack 1, win 1573, length 204
00:57:03.881950 IP comp3134-Winter2023.ssh > cpee0dbd1ce3c00-cme0dbd1ce3bfe.cpe.net.cable.rogers.com.62719: Flags [P.], seq 46900:47104, ack 1, win 1573, length 204
00:57:03.882000 IP comp3134-Winter2023.ssh > cpee0dbd1ce3c00-cme0dbd1ce3bfe.cpe.net.cable.rogers.com.62719: Flags [P.], seq 47104:47308, ack 1, win 1573, length 204
00:57:03.882063 IP comp3134-Winter2023.ssh > cpee0dbd1ce3c00-cme0dbd1ce3bfe.cpe.net.cable.rogers.com.62719: Flags [P.], seq 47308:47512, ack 1, win 1573, length 204
00:57:03.882118 IP comp3134-Winter2023.ssh > cpee0dbd1ce3c00-cme0dbd1ce3bfe.cpe.net.cable.rogers.com.62719: Flags [P.], seq 47512:47716, ack 1, win 1573, length 204
00:57:03.882166 IP comp3134-Winter2023.ssh > cpee0dbd1ce3c00-cme0dbd1ce3bfe.cpe.net.cable.rogers.com.62719: Flags [P.], seq 47716:47920, ack 1, win 1573, length 204
00:57:03.882213 IP comp3134-Winter2023.ssh > cpee0dbd1ce3c00-cme0dbd1ce3bfe.cpe.net.cable.rogers.com.62719: Flags [P.], seq 47920:48124, ack 1, win 1573, length 204
00:57:03.882261 IP comp3134-Winter2023.ssh > cpee0dbd1ce3c00-cme0dbd1ce3bfe.cpe.net.cable.rogers.com.62719: Flags [P.], seq 48124:48328, ack 1, win 1573, length 204
00:57:03.882309 IP comp3134-Winter2023.ssh > cpee0dbd1ce3c00-cme0dbd1ce3bfe.cpe.net.cable.rogers.com.62719: Flags [P.], seq 48328:48532, ack 1, win 1573, length 204
00:57:03.882357 IP comp3134-Winter2023.ssh > cpee0dbd1ce3c00-cme0dbd1ce3bfe.cpe.net.cable.rogers.com.62719: Flags [P.], seq 48532:48736, ack 1, win 1573, length 204
00:57:03.882406 IP comp3134-Winter2023.ssh > cpee0dbd1ce3c00-cme0dbd1ce3bfe.cpe.net.cable.rogers.com.62719: Flags [P.], seq 48736:48940, ack 1, win 1573, length 204
00:57:03.882455 IP comp3134-Winter2023.ssh > cpee0dbd1ce3c00-cme0dbd1ce3bfe.cpe.net.cable.rogers.com.62719: Flags [P.], seq 48940:49144, ack 1, win 1573, length 204
00:57:03.882508 IP comp3134-Winter2023.ssh > cpee0dbd1ce3c00-cme0dbd1ce3bfe.cpe.net.cable.rogers.com.62719: Flags [P.], seq 49144:49348, ack 1, win 1573, length 204
00:57:03.882555 IP comp3134-Winter2023.ssh > cpee0dbd1ce3c00-cme0dbd1ce3bfe.cpe.net.cable.rogers.com.62719: Flags [P.], seq 49348:49552, ack 1, win 1573, length 204
00:57:03.882601 IP comp3134-Winter2023.ssh > cpee0dbd1ce3c00-cme0dbd1ce3bfe.cpe.net.cable.rogers.com.62719: Flags [P.], seq 49552:49756, ack 1, win 1573, length 204
00:57:03.882661 IP comp3134-Winter2023.ssh > cpee0dbd1ce3c00-cme0dbd1ce3bfe.cpe.net.cable.rogers.com.62719: Flags [P.], seq 49756:49960, ack 1, win 1573, length 204
00:57:03.882730 IP comp3134-Winter2023.ssh > cpee0dbd1ce3c00-cme0dbd1ce3bfe.cpe.net.cable.rogers.com.62719: Flags [P.], seq 49960:50164, ack 1, win 1573, length 204
00:57:03.882800 IP comp3134-Winter2023.ssh > cpee0dbd1ce3c00-cme0dbd1ce3bfe.cpe.net.cable.rogers.com.62719: Flags [P.], seq 50164:50368, ack 1, win 1573, length 204
00:57:03.882852 IP comp3134-Winter2023.ssh > cpee0dbd1ce3c00-cme0dbd1ce3bfe.cpe.net.cable.rogers.com.62719: Flags [P.], seq 50368:50572, ack 1, win 1573, length 204
00:57:03.882901 IP comp3134-Winter2023.ssh > cpee0dbd1ce3c00-cme0dbd1ce3bfe.cpe.net.cable.rogers.com.62719: Flags [P.], seq 50572:50776, ack 1, win 1573, length 204
00:57:03.882948 IP comp3134-Winter2023.ssh > cpee0dbd1ce3c00-cme0dbd1ce3bfe.cpe.net.cable.rogers.com.62719: Flags [P.], seq 50776:50980, ack 1, win 1573, length 204
00:57:03.882995 IP comp3134-Winter2023.ssh > cpee0dbd1ce3c00-cme0dbd1ce3bfe.cpe.net.cable.rogers.com.62719: Flags [P.], seq 50980:51184, ack 1, win 1573, length 204
00:57:03.883042 IP comp3134-Winter2023.ssh > cpee0dbd1ce3c00-cme0dbd1ce3bfe.cpe.net.cable.rogers.com.62719: Flags [P.], seq 51184:51388, ack 1, win 1573, length 204
00:57:03.883090 IP comp3134-Winter2023.ssh > cpee0dbd1ce3c00-cme0dbd1ce3bfe.cpe.net.cable.rogers.com.62719: Flags [P.], seq 51388:51592, ack 1, win 1573, length 204
00:57:03.883138 IP comp3134-Winter2023.ssh > cpee0dbd1ce3c00-cme0dbd1ce3bfe.cpe.net.cable.rogers.com.62719: Flags [P.], seq 51592:51796, ack 1, win 1573, length 204
00:57:03.883186 IP comp3134-Winter2023.ssh > cpee0dbd1ce3c00-cme0dbd1ce3bfe.cpe.net.cable.rogers.com.62719: Flags [P.], seq 51796:52000, ack 1, win 1573, length 204
00:57:03.883234 IP comp3134-Winter2023.ssh > cpee0dbd1ce3c00-cme0dbd1ce3bfe.cpe.net.cable.rogers.com.62719: Flags [P.], seq 52000:52204, ack 1, win 1573, length 204
